### ISSUE TITLE
X1Plus Camera Daemon runs out of TLS Session Slots and hangs

### ISSUE THREAD

**Issue by lightmaster** [X1Plus/X1Plus#553]
**Describe the bug**
I've been working with the developer of Bambuddy to figure out why my X1C running X1Plus drops the camera feed after printing for a little while. If I start a print, then around 30 minutes after the print start, Bambuddy will lose the connection to the camera. The only thing that will get it to connect again is restarting the X1C. While the printer is in the state where Bambuddy can't connect to the camera, he computer running Bambuddy says that port 322 is open, however it still can't establish a connection to the camera itself. The developer told me to put this bug report up here, along with the tcp dumps and support package from program that contains the logs and stuff.

Here's what he said about the cause of the issue:
(https://github.com/maziggy/bambuddy/issues/925)
> The capture is very clear: on every new camera attempt the TCP three-way handshake to port 322 succeeds, bambuddy pushes ~1555 bytes (the TLS ClientHello), and the printer ACKs it at the TCP layer but never sends a TLS ServerHello back. That's the camera service on the printer being hung at the TLS layer — not a network issue and not something bambuddy can fix from the outside. It also explains why nc -zv keeps passing (it only tests the SYN) and why OrcaSlicer keeps working (it's holding an already-established session from before the hang). You can also see a bunch of old bambuddy source ports still getting stale ACKs from the printer long after bambuddy closed them, which looks like server-side sockets not being reaped. That's consistent with the camera daemon slowly running out of TLS session slots and then refusing new handshakes until the printer reboots — which matches your 35-minute / 10-hour failure windows and the "reboot the printer and it works again" remedy.

<details>
  <summary>tcp dump 1:</summary>

```zsh
root@bambuddy [07:16:13 PM] [~] 
-> # tcpdump -ni any host 10.0.0.227 and port 322
tcpdump: WARNING: any: That device doesn't support promiscuous mode
(Promiscuous mode not supported on the "any" device)
tcpdump: verbose output suppressed, use -v[v]... for full protocol decode
listening on any, link-type LINUX_SLL2 (Linux cooked v2), snapshot length 262144 bytes
19:16:25.103098 eth0  Out IP 10.14.166.201.48746 > 10.0.0.227.322: Flags [S], seq 215195784, win 64240, options [mss 1460,sackOK,TS val 1535352438 ecr 0,nop,wscale 7], length 0
19:16:25.105497 eth0  In  IP 10.0.0.227.322 > 10.14.166.201.48746: Flags [S.], seq 853431693, ack 215195785, win 43440, options [mss 1460,sackOK,TS val 2690794743 ecr 1535352438,nop,wscale 8], length 0
19:16:25.105508 eth0  Out IP 10.14.166.201.48746 > 10.0.0.227.322: Flags [.], ack 1, win 502, options [nop,nop,TS val 1535352441 ecr 2690794743], length 0
19:16:25.105985 eth0  Out IP 10.14.166.201.48746 > 10.0.0.227.322: Flags [P.], seq 1:1556, ack 1, win 502, options [nop,nop,TS val 1535352441 ecr 2690794743], length 1555
19:16:25.109791 eth0  In  IP 10.0.0.227.322 > 10.14.166.201.48746: Flags [.], ack 1449, win 165, options [nop,nop,TS val 2690794747 ecr 1535352441], length 0
19:16:25.110155 eth0  In  IP 10.0.0.227.322 > 10.14.166.201.48746: Flags [.], ack 1556, win 165, options [nop,nop,TS val 2690794747 ecr 1535352441], length 0
19:16:27.126894 eth0  In  IP 10.0.0.227.322 > 10.14.166.201.51580: Flags [.], ack 3760338359, win 165, options [nop,nop,TS val 2690796761 ecr 1535174199], length 0
19:16:27.126909 eth0  Out IP 10.14.166.201.51580 > 10.0.0.227.322: Flags [R], seq 3760338359, win 0, length 0
19:16:30.414842 eth0  Out IP 10.14.166.201.48738 > 10.0.0.227.322: Flags [F.], seq 3208878707, ack 2672148591, win 502, options [nop,nop,TS val 1535357750 ecr 2690790066], length 0
19:16:30.459500 eth0  In  IP 10.0.0.227.322 > 10.14.166.201.48738: Flags [.], ack 1, win 165, options [nop,nop,TS val 2690800096 ecr 1535357750], length 0
19:16:35.101589 eth0  Out IP 10.14.166.201.48746 > 10.0.0.227.322: Flags [F.], seq 1556, ack 1, win 502, options [nop,nop,TS val 1535362437 ecr 2690794747], length 0
19:16:35.150987 eth0  In  IP 10.0.0.227.322 > 10.14.166.201.48746: Flags [.], ack 1557, win 165, options [nop,nop,TS val 2690804785 ecr 1535362437], length 0
19:16:35.352083 eth0  Out IP 10.14.166.201.41852 > 10.0.0.227.322: Flags [S], seq 1706476983, win 64240, options [mss 1460,sackOK,TS val 1535362687 ecr 0,nop,wscale 7], length 0
19:16:35.365498 eth0  In  IP 10.0.0.227.322 > 10.14.166.201.41852: Flags [S.], seq 4108734180, ack 1706476984, win 43440, options [mss 1460,sackOK,TS val 2690805003 ecr 1535362687,nop,wscale 8], length 0
19:16:35.365513 eth0  Out IP 10.14.166.201.41852 > 10.0.0.227.322: Flags [.], ack 1, win 502, options [nop,nop,TS val 1535362701 ecr 2690805003], length 0
19:16:35.366049 eth0  Out IP 10.14.166.201.41852 > 10.0.0.227.322: Flags [P.], seq 1:1556, ack 1, win 502, options [nop,nop,TS val 1535362701 ecr 2690805003], length 1555
19:16:35.368615 eth0  In  IP 10.0.0.227.322 > 10.14.166.201.41852: Flags [.], ack 1449, win 165, options [nop,nop,TS val 2690805006 ecr 1535362701], length 0
19:16:35.369056 eth0  In  IP 10.0.0.227.322 > 10.14.166.201.41852: Flags [.], ack 1556, win 165, options [nop,nop,TS val 2690805006 ecr 1535362701], length 0
19:16:37.364209 eth0  In  IP 10.0.0.227.322 > 10.14.166.201.45592: Flags [.], ack 341776112, win 165, options [nop,nop,TS val 2690807001 ecr 1535184484], length 0
19:16:37.364222 eth0  Out IP 10.14.166.201.45592 > 10.0.0.227.322: Flags [R], seq 341776112, win 0, length 0
19:16:37.373725 eth0  Out IP 10.14.166.201.51290 > 10.0.0.227.322: Flags [S], seq 3725102437, win 64240, options [mss 1460,sackOK,TS val 1535364709 ecr 0,nop,wscale 7], length 0
19:16:37.376624 eth0  In  IP 10.0.0.227.322 > 10.14.166.201.51290: Flags [S.], seq 3987959858, ack 3725102438, win 43440, options [mss 1460,sackOK,TS val 2690807014 ecr 1535364709,nop,wscale 8], length 0
19:16:37.376635 eth0  Out IP 10.14.166.201.51290 > 10.0.0.227.322: Flags [.], ack 1, win 502, options [nop,nop,TS val 1535364712 ecr 2690807014], length 0
19:16:37.377097 eth0  Out IP 10.14.166.201.51290 > 10.0.0.227.322: Flags [P.], seq 1:1556, ack 1, win 502, options [nop,nop,TS val 1535364712 ecr 2690807014], length 1555
19:16:37.381225 eth0  In  IP 10.0.0.227.322 > 10.14.166.201.51290: Flags [.], ack 1556, win 165, options [nop,nop,TS val 2690807018 ecr 1535364712], length 0
19:16:41.381511 eth0  Out IP 10.14.166.201.51302 > 10.0.0.227.322: Flags [S], seq 987504955, win 64240, options [mss 1460,sackOK,TS val 1535368717 ecr 0,nop,wscale 7], length 0
19:16:41.388278 eth0  In  IP 10.0.0.227.322 > 10.14.166.201.51302: Flags [S.], seq 1742506618, ack 987504956, win 43440, options [mss 1460,sackOK,TS val 2690811025 ecr 1535368717,nop,wscale 8], length 0
19:16:41.388292 eth0  Out IP 10.14.166.201.51302 > 10.0.0.227.322: Flags [.], ack 1, win 502, options [nop,nop,TS val 1535368723 ecr 2690811025], length 0
19:16:41.388966 eth0  Out IP 10.14.166.201.51302 > 10.0.0.227.322: Flags [P.], seq 1:1556, ack 1, win 502, options [nop,nop,TS val 1535368724 ecr 2690811025], length 1555
19:16:41.392213 eth0  In  IP 10.0.0.227.322 > 10.14.166.201.51302: Flags [.], ack 1556, win 165, options [nop,nop,TS val 2690811030 ecr 1535368724], length 0
19:16:45.351100 eth0  Out IP 10.14.166.201.41852 > 10.0.0.227.322: Flags [F.], seq 1556, ack 1, win 502, options [nop,nop,TS val 1535372686 ecr 2690805006], length 0
19:16:45.395000 eth0  In  IP 10.0.0.227.322 > 10.14.166.201.41852: Flags [.], ack 1557, win 165, options [nop,nop,TS val 2690815031 ecr 1535372686], length 0
19:16:47.373106 eth0  Out IP 10.14.166.201.51290 > 10.0.0.227.322: Flags [F.], seq 1556, ack 1, win 502, options [nop,nop,TS val 1535374708 ecr 2690807018], length 0
19:16:47.420994 eth0  In  IP 10.0.0.227.322 > 10.14.166.201.51290: Flags [.], ack 1557, win 165, options [nop,nop,TS val 2690817054 ecr 1535374708], length 0
19:16:47.604614 eth0  In  IP 10.0.0.227.322 > 10.14.166.201.38060: Flags [.], ack 1022464765, win 165, options [nop,nop,TS val 2690817241 ecr 1535194777], length 0
19:16:47.604627 eth0  Out IP 10.14.166.201.38060 > 10.0.0.227.322: Flags [R], seq 1022464765, win 0, length 0
19:16:49.393983 eth0  Out IP 10.14.166.201.46826 > 10.0.0.227.322: Flags [S], seq 256953989, win 64240, options [mss 1460,sackOK,TS val 1535376729 ecr 0,nop,wscale 7], length 0
19:16:49.408240 eth0  In  IP 10.0.0.227.322 > 10.14.166.201.46826: Flags [S.], seq 619007358, ack 256953990, win 43440, options [mss 1460,sackOK,TS val 2690819045 ecr 1535376729,nop,wscale 8], length 0
19:16:49.408254 eth0  Out IP 10.14.166.201.46826 > 10.0.0.227.322: Flags [.], ack 1, win 502, options [nop,nop,TS val 1535376743 ecr 2690819045], length 0
19:16:49.408837 eth0  Out IP 10.14.166.201.46826 > 10.0.0.227.322: Flags [P.], seq 1:1556, ack 1, win 502, options [nop,nop,TS val 1535376744 ecr 2690819045], length 1555
19:16:49.411110 eth0  In  IP 10.0.0.227.322 > 10.14.166.201.46826: Flags [.], ack 1449, win 165, options [nop,nop,TS val 2690819048 ecr 1535376744], length 0
19:16:49.411556 eth0  In  IP 10.0.0.227.322 > 10.14.166.201.46826: Flags [.], ack 1556, win 165, options [nop,nop,TS val 2690819049 ecr 1535376744], length 0
19:16:51.377845 eth0  Out IP 10.14.166.201.51302 > 10.0.0.227.322: Flags [F.], seq 1556, ack 1, win 502, options [nop,nop,TS val 1535378713 ecr 2690811030], length 0
19:16:51.423411 eth0  In  IP 10.0.0.227.322 > 10.14.166.201.51302: Flags [.], ack 1557, win 165, options [nop,nop,TS val 2690821057 ecr 1535378713], length 0
19:16:55.796383 eth0  In  IP 10.0.0.227.322 > 10.14.166.201.38070: Flags [.], ack 3646742345, win 165, options [nop,nop,TS val 2690825433 ecr 1535202793], length 0
19:16:55.796395 eth0  Out IP 10.14.166.201.38070 > 10.0.0.227.322: Flags [R], seq 3646742345, win 0, length 0
19:16:59.392881 eth0  Out IP 10.14.166.201.46826 > 10.0.0.227.322: Flags [F.], seq 1556, ack 1, win 502, options [nop,nop,TS val 1535386728 ecr 2690819049], length 0
19:16:59.435279 eth0  In  IP 10.0.0.227.322 > 10.14.166.201.46826: Flags [.], ack 1557, win 165, options [nop,nop,TS val 2690829072 ecr 1535386728], length 0
19:16:59.680290 eth0  Out IP 10.14.166.201.59844 > 10.0.0.227.322: Flags [S], seq 1858987257, win 64240, options [mss 1460,sackOK,TS val 1535387015 ecr 0,nop,wscale 7], length 0
19:16:59.687639 eth0  In  IP 10.0.0.227.322 > 10.14.166.201.59844: Flags [S.], seq 2101707377, ack 1858987258, win 43440, options [mss 1460,sackOK,TS val 2690829322 ecr 1535387015,nop,wscale 8], length 0
19:16:59.687650 eth0  Out IP 10.14.166.201.59844 > 10.0.0.227.322: Flags [.], ack 1, win 502, options [nop,nop,TS val 1535387023 ecr 2690829322], length 0
19:16:59.688186 eth0  Out IP 10.14.166.201.59844 > 10.0.0.227.322: Flags [P.], seq 1:1556, ack 1, win 502, options [nop,nop,TS val 1535387023 ecr 2690829322], length 1555
19:16:59.691846 eth0  In  IP 10.0.0.227.322 > 10.14.166.201.59844: Flags [.], ack 1449, win 165, options [nop,nop,TS val 2690829329 ecr 1535387023], length 0
19:16:59.692248 eth0  In  IP 10.0.0.227.322 > 10.14.166.201.59844: Flags [.], ack 1556, win 165, options [nop,nop,TS val 2690829329 ecr 1535387023], length 0
19:17:05.409331 eth0  Out IP 10.14.166.201.59850 > 10.0.0.227.322: Flags [S], seq 1881478404, win 64240, options [mss 1460,sackOK,TS val 1535392744 ecr 0,nop,wscale 7], length 0
19:17:05.412515 eth0  In  IP 10.0.0.227.322 > 10.14.166.201.59850: Flags [S.], seq 2322296117, ack 1881478405, win 43440, options [mss 1460,sackOK,TS val 2690835050 ecr 1535392744,nop,wscale 8], length 0
19:17:05.412527 eth0  Out IP 10.14.166.201.59850 > 10.0.0.227.322: Flags [.], ack 1, win 502, options [nop,nop,TS val 1535392748 ecr 2690835050], length 0
19:17:05.413034 eth0  Out IP 10.14.166.201.59850 > 10.0.0.227.322: Flags [P.], seq 1:1556, ack 1, win 502, options [nop,nop,TS val 1535392748 ecr 2690835050], length 1555
19:17:05.417417 eth0  In  IP 10.0.0.227.322 > 10.14.166.201.59850: Flags [.], ack 1449, win 165, options [nop,nop,TS val 2690835054 ecr 1535392748], length 0
19:17:05.417764 eth0  In  IP 10.0.0.227.322 > 10.14.166.201.59850: Flags [.], ack 1556, win 165, options [nop,nop,TS val 2690835054 ecr 1535392748], length 0
19:17:06.036456 eth0  In  IP 10.0.0.227.322 > 10.14.166.201.46120: Flags [.], ack 2915898964, win 165, options [nop,nop,TS val 2690835673 ecr 1535213082], length 0
19:17:06.036471 eth0  Out IP 10.14.166.201.46120 > 10.0.0.227.322: Flags [R], seq 2915898964, win 0, length 0
19:17:09.680814 eth0  Out IP 10.14.166.201.59844 > 10.0.0.227.322: Flags [F.], seq 1556, ack 1, win 502, options [nop,nop,TS val 1535397016 ecr 2690829329], length 0
19:17:09.723552 eth0  In  IP 10.0.0.227.322 > 10.14.166.201.59844: Flags [.], ack 1557, win 165, options [nop,nop,TS val 2690839360 ecr 1535397016], length 0
19:17:15.408791 eth0  Out IP 10.14.166.201.59850 > 10.0.0.227.322: Flags [F.], seq 1556, ack 1, win 502, options [nop,nop,TS val 1535402744 ecr 2690835054], length 0
19:17:15.452446 eth0  In  IP 10.0.0.227.322 > 10.14.166.201.59850: Flags [.], ack 1557, win 165, options [nop,nop,TS val 2690845090 ecr 1535402744], length 0
19:17:15.699146 eth0  Out IP 10.14.166.201.47028 > 10.0.0.227.322: Flags [S], seq 3111251703, win 64240, options [mss 1460,sackOK,TS val 1535403034 ecr 0,nop,wscale 7], length 0
19:17:15.703081 eth0  In  IP 10.0.0.227.322 > 10.14.166.201.47028: Flags [S.], seq 3517027008, ack 3111251704, win 43440, options [mss 1460,sackOK,TS val 2690845339 ecr 1535403034,nop,wscale 8], length 0
19:17:15.703093 eth0  Out IP 10.14.166.201.47028 > 10.0.0.227.322: Flags [.], ack 1, win 502, options [nop,nop,TS val 1535403038 ecr 2690845339], length 0
19:17:15.703621 eth0  Out IP 10.14.166.201.47028 > 10.0.0.227.322: Flags [P.], seq 1:1556, ack 1, win 502, options [nop,nop,TS val 1535403039 ecr 2690845339], length 1555
19:17:15.706586 eth0  In  IP 10.0.0.227.322 > 10.14.166.201.47028: Flags [.], ack 1449, win 165, options [nop,nop,TS val 2690845344 ecr 1535403039], length 0
19:17:15.706998 eth0  In  IP 10.0.0.227.322 > 10.14.166.201.47028: Flags [.], ack 1556, win 165, options [nop,nop,TS val 2690845344 ecr 1535403039], length 0
19:17:16.276490 eth0  In  IP 10.0.0.227.322 > 10.14.166.201.56492: Flags [.], ack 1442098359, win 165, options [nop,nop,TS val 2690845914 ecr 1535223371], length 0
19:17:16.276502 eth0  Out IP 10.14.166.201.56492 > 10.0.0.227.322: Flags [R], seq 1442098359, win 0, length 0
19:17:25.698550 eth0  Out IP 10.14.166.201.47028 > 10.0.0.227.322: Flags [F.], seq 1556, ack 1, win 502, options [nop,nop,TS val 1535413034 ecr 2690845344], length 0
19:17:25.744351 eth0  In  IP 10.0.0.227.322 > 10.14.166.201.47028: Flags [.], ack 1557, win 165, options [nop,nop,TS val 2690855380 ecr 1535413034], length 0
19:17:25.987904 eth0  Out IP 10.14.166.201.53360 > 10.0.0.227.322: Flags [S], seq 1578430202, win 64240, options [mss 1460,sackOK,TS val 1535413323 ecr 0,nop,wscale 7], length 0
19:17:25.990415 eth0  In  IP 10.0.0.227.322 > 10.14.166.201.53360: Flags [S.], seq 3225388618, ack 1578430203, win 43440, options [mss 1460,sackOK,TS val 2690855628 ecr 1535413323,nop,wscale 8], length 0
19:17:25.990425 eth0  Out IP 10.14.166.201.53360 > 10.0.0.227.322: Flags [.], ack 1, win 502, options [nop,nop,TS val 1535413326 ecr 2690855628], length 0
19:17:25.990910 eth0  Out IP 10.14.166.201.53360 > 10.0.0.227.322: Flags [P.], seq 1:1556, ack 1, win 502, options [nop,nop,TS val 1535413326 ecr 2690855628], length 1555
19:17:25.996387 eth0  In  IP 10.0.0.227.322 > 10.14.166.201.53360: Flags [.], ack 1449, win 165, options [nop,nop,TS val 2690855633 ecr 1535413326], length 0
19:17:25.996778 eth0  In  IP 10.0.0.227.322 > 10.14.166.201.53360: Flags [.], ack 1556, win 165, options [nop,nop,TS val 2690855634 ecr 1535413326], length 0
19:17:26.516639 eth0  In  IP 10.0.0.227.322 > 10.14.166.201.44028: Flags [.], ack 1849576861, win 165, options [nop,nop,TS val 2690856154 ecr 1535233658], length 0
19:17:26.516652 eth0  Out IP 10.14.166.201.44028 > 10.0.0.227.322: Flags [R], seq 1849576861, win 0, length 0
19:17:35.482330 eth0  Out IP 10.14.166.201.35236 > 10.0.0.227.322: Flags [S], seq 75875118, win 64240, options [mss 1460,sackOK,TS val 1535422817 ecr 0,nop,wscale 7], length 0
19:17:35.505790 eth0  In  IP 10.0.0.227.322 > 10.14.166.201.35236: Flags [S.], seq 4037449958, ack 75875119, win 43440, options [mss 1460,sackOK,TS val 2690865143 ecr 1535422817,nop,wscale 8], length 0
19:17:35.505803 eth0  Out IP 10.14.166.201.35236 > 10.0.0.227.322: Flags [.], ack 1, win 502, options [nop,nop,TS val 1535422841 ecr 2690865143], length 0
19:17:35.506272 eth0  Out IP 10.14.166.201.35236 > 10.0.0.227.322: Flags [P.], seq 1:1556, ack 1, win 502, options [nop,nop,TS val 1535422841 ecr 2690865143], length 1555
19:17:35.514886 eth0  In  IP 10.0.0.227.322 > 10.14.166.201.35236: Flags [.], ack 1449, win 165, options [nop,nop,TS val 2690865151 ecr 1535422841], length 0
19:17:35.514887 eth0  In  IP 10.0.0.227.322 > 10.14.166.201.35236: Flags [.], ack 1556, win 165, options [nop,nop,TS val 2690865151 ecr 1535422841], length 0
19:17:35.986848 eth0  Out IP 10.14.166.201.53360 > 10.0.0.227.322: Flags [F.], seq 1556, ack 1, win 502, options [nop,nop,TS val 1535423322 ecr 2690855634], length 0
19:17:36.029778 eth0  In  IP 10.0.0.227.322 > 10.14.166.201.53360: Flags [.], ack 1557, win 165, options [nop,nop,TS val 2690865667 ecr 1535423322], length 0
19:17:36.759938 eth0  In  IP 10.0.0.227.322 > 10.14.166.201.46636: Flags [.], ack 848880661, win 165, options [nop,nop,TS val 2690866394 ecr 1535243952], length 0
19:17:36.759948 eth0  Out IP 10.14.166.201.46636 > 10.0.0.227.322: Flags [R], seq 848880661, win 0, length 0
^C
94 packets captured
96 packets received by filter
0 packets dropped by kernel
```
</details>

<details>
  <summary>tcp dump 2:</summary>
  
  ```zsh
root@bambuddy [08:23:25 PM] [~] 
-> # tcpdump -ni any host 10.0.0.227 and port 322
tcpdump: WARNING: any: That device doesn't support promiscuous mode
(Promiscuous mode not supported on the "any" device)
tcpdump: verbose output suppressed, use -v[v]... for full protocol decode
listening on any, link-type LINUX_SLL2 (Linux cooked v2), snapshot length 262144 bytes
20:23:30.814761 eth0  Out IP 10.14.166.201.39030 > 10.0.0.227.322: Flags [F.], seq 1260944876, ack 4219583960, win 502, options [nop,nop,TS val 1539378150 ecr 4279516970], length 0
20:23:30.864545 eth0  In  IP 10.0.0.227.322 > 10.14.166.201.39030: Flags [.], ack 1, win 165, options [nop,nop,TS val 4279526995 ecr 1539378150], length 0
20:23:30.873235 eth0  Out IP 10.14.166.201.37004 > 10.0.0.227.322: Flags [S], seq 1321102410, win 64240, options [mss 1460,sackOK,TS val 1539378208 ecr 0,nop,wscale 7], length 0
20:23:30.875737 eth0  In  IP 10.0.0.227.322 > 10.14.166.201.37004: Flags [S.], seq 1210605737, ack 1321102411, win 43440, options [mss 1460,sackOK,TS val 4279527009 ecr 1539378208,nop,wscale 8], length 0
20:23:30.875753 eth0  Out IP 10.14.166.201.37004 > 10.0.0.227.322: Flags [.], ack 1, win 502, options [nop,nop,TS val 1539378211 ecr 4279527009], length 0
20:23:30.876265 eth0  Out IP 10.14.166.201.37004 > 10.0.0.227.322: Flags [P.], seq 1:1556, ack 1, win 502, options [nop,nop,TS val 1539378211 ecr 4279527009], length 1555
20:23:30.879098 eth0  In  IP 10.0.0.227.322 > 10.14.166.201.37004: Flags [.], ack 1449, win 165, options [nop,nop,TS val 4279527013 ecr 1539378211], length 0
20:23:30.879354 eth0  In  IP 10.0.0.227.322 > 10.14.166.201.37004: Flags [.], ack 1556, win 165, options [nop,nop,TS val 4279527013 ecr 1539378211], length 0
20:23:32.880326 eth0  Out IP 10.14.166.201.37020 > 10.0.0.227.322: Flags [S], seq 4074383136, win 64240, options [mss 1460,sackOK,TS val 1539380215 ecr 0,nop,wscale 7], length 0
20:23:32.885648 eth0  In  IP 10.0.0.227.322 > 10.14.166.201.37020: Flags [S.], seq 1333817328, ack 4074383137, win 43440, options [mss 1460,sackOK,TS val 4279529019 ecr 1539380215,nop,wscale 8], length 0
20:23:32.885657 eth0  Out IP 10.14.166.201.37020 > 10.0.0.227.322: Flags [.], ack 1, win 502, options [nop,nop,TS val 1539380221 ecr 4279529019], length 0
20:23:32.886174 eth0  Out IP 10.14.166.201.37020 > 10.0.0.227.322: Flags [P.], seq 1:1556, ack 1, win 502, options [nop,nop,TS val 1539380221 ecr 4279529019], length 1555
20:23:32.888989 eth0  In  IP 10.0.0.227.322 > 10.14.166.201.37020: Flags [.], ack 1449, win 165, options [nop,nop,TS val 4279529023 ecr 1539380221], length 0
20:23:32.889367 eth0  In  IP 10.0.0.227.322 > 10.14.166.201.37020: Flags [.], ack 1556, win 165, options [nop,nop,TS val 4279529023 ecr 1539380221], length 0
20:23:34.928870 eth0  In  IP 10.0.0.227.322 > 10.14.166.201.38698: Flags [.], ack 1178917605, win 165, options [nop,nop,TS val 4279531059 ecr 1539202053], length 0
20:23:34.928886 eth0  Out IP 10.14.166.201.38698 > 10.0.0.227.322: Flags [R], seq 1178917605, win 0, length 0
20:23:37.101796 eth0  Out IP 10.14.166.201.47352 > 10.0.0.227.322: Flags [S], seq 1059088942, win 64240, options [mss 1460,sackOK,TS val 1539384437 ecr 0,nop,wscale 7], length 0
20:23:37.108350 eth0  In  IP 10.0.0.227.322 > 10.14.166.201.47352: Flags [S.], seq 2387663428, ack 1059088943, win 43440, options [mss 1460,sackOK,TS val 4279533242 ecr 1539384437,nop,wscale 8], length 0
20:23:37.108361 eth0  Out IP 10.14.166.201.47352 > 10.0.0.227.322: Flags [.], ack 1, win 502, options [nop,nop,TS val 1539384444 ecr 4279533242], length 0
20:23:37.108876 eth0  Out IP 10.14.166.201.47352 > 10.0.0.227.322: Flags [P.], seq 1:1556, ack 1, win 502, options [nop,nop,TS val 1539384444 ecr 4279533242], length 1555
20:23:37.112417 eth0  In  IP 10.0.0.227.322 > 10.14.166.201.47352: Flags [.], ack 1556, win 165, options [nop,nop,TS val 4279533246 ecr 1539384444], length 0
20:23:37.112441 eth0  In  IP 10.0.0.227.322 > 10.14.166.201.47352: Flags [.], ack 1556, win 165, options [nop,nop,TS val 4279533246 ecr 1539384444], length 0
20:23:40.871934 eth0  Out IP 10.14.166.201.37004 > 10.0.0.227.322: Flags [F.], seq 1556, ack 1, win 502, options [nop,nop,TS val 1539388207 ecr 4279527013], length 0
20:23:40.932885 eth0  In  IP 10.0.0.227.322 > 10.14.166.201.37004: Flags [.], ack 1557, win 165, options [nop,nop,TS val 4279537063 ecr 1539388207], length 0
20:23:42.878958 eth0  Out IP 10.14.166.201.37020 > 10.0.0.227.322: Flags [F.], seq 1556, ack 1, win 502, options [nop,nop,TS val 1539390214 ecr 4279529023], length 0
20:23:42.940019 eth0  In  IP 10.0.0.227.322 > 10.14.166.201.37020: Flags [.], ack 1557, win 165, options [nop,nop,TS val 4279539070 ecr 1539390214], length 0
20:23:44.892873 eth0  Out IP 10.14.166.201.47366 > 10.0.0.227.322: Flags [S], seq 2278818559, win 64240, options [mss 1460,sackOK,TS val 1539392228 ecr 0,nop,wscale 7], length 0
20:23:44.901101 eth0  In  IP 10.0.0.227.322 > 10.14.166.201.47366: Flags [S.], seq 2500561837, ack 2278818560, win 43440, options [mss 1460,sackOK,TS val 4279541035 ecr 1539392228,nop,wscale 8], length 0
20:23:44.901129 eth0  Out IP 10.14.166.201.47366 > 10.0.0.227.322: Flags [.], ack 1, win 502, options [nop,nop,TS val 1539392236 ecr 4279541035], length 0
20:23:44.901754 eth0  Out IP 10.14.166.201.47366 > 10.0.0.227.322: Flags [P.], seq 1:1556, ack 1, win 502, options [nop,nop,TS val 1539392237 ecr 4279541035], length 1555
20:23:44.903877 eth0  In  IP 10.0.0.227.322 > 10.14.166.201.47366: Flags [.], ack 1556, win 165, options [nop,nop,TS val 4279541038 ecr 1539392237], length 0
20:23:45.168495 eth0  In  IP 10.0.0.227.322 > 10.14.166.201.53012: Flags [.], ack 888287978, win 165, options [nop,nop,TS val 4279541299 ecr 1539212341], length 0
20:23:45.168511 eth0  Out IP 10.14.166.201.53012 > 10.0.0.227.322: Flags [R], seq 888287978, win 0, length 0
20:23:47.101019 eth0  Out IP 10.14.166.201.47352 > 10.0.0.227.322: Flags [F.], seq 1556, ack 1, win 502, options [nop,nop,TS val 1539394436 ecr 4279533246], length 0
20:23:47.150606 eth0  In  IP 10.0.0.227.322 > 10.14.166.201.47352: Flags [.], ack 1557, win 165, options [nop,nop,TS val 4279543281 ecr 1539394436], length 0
20:23:54.891130 eth0  Out IP 10.14.166.201.47366 > 10.0.0.227.322: Flags [F.], seq 1556, ack 1, win 502, options [nop,nop,TS val 1539402226 ecr 4279541038], length 0
20:23:54.938317 eth0  In  IP 10.0.0.227.322 > 10.14.166.201.47366: Flags [.], ack 1557, win 165, options [nop,nop,TS val 4279551071 ecr 1539402226], length 0
20:23:55.180291 eth0  Out IP 10.14.166.201.41542 > 10.0.0.227.322: Flags [S], seq 3137610013, win 64240, options [mss 1460,sackOK,TS val 1539402515 ecr 0,nop,wscale 7], length 0
20:23:55.186553 eth0  In  IP 10.0.0.227.322 > 10.14.166.201.41542: Flags [S.], seq 346214212, ack 3137610014, win 43440, options [mss 1460,sackOK,TS val 4279551320 ecr 1539402515,nop,wscale 8], length 0
20:23:55.186567 eth0  Out IP 10.14.166.201.41542 > 10.0.0.227.322: Flags [.], ack 1, win 502, options [nop,nop,TS val 1539402522 ecr 4279551320], length 0
20:23:55.187110 eth0  Out IP 10.14.166.201.41542 > 10.0.0.227.322: Flags [P.], seq 1:1556, ack 1, win 502, options [nop,nop,TS val 1539402522 ecr 4279551320], length 1555
20:23:55.191190 eth0  In  IP 10.0.0.227.322 > 10.14.166.201.41542: Flags [.], ack 1449, win 165, options [nop,nop,TS val 4279551324 ecr 1539402522], length 0
20:23:55.191570 eth0  In  IP 10.0.0.227.322 > 10.14.166.201.41542: Flags [.], ack 1556, win 165, options [nop,nop,TS val 4279551325 ecr 1539402522], length 0
20:23:55.408561 eth0  In  IP 10.0.0.227.322 > 10.14.166.201.44802: Flags [.], ack 1788119857, win 165, options [nop,nop,TS val 4279551539 ecr 1539222629], length 0
20:23:55.408574 eth0  Out IP 10.14.166.201.44802 > 10.0.0.227.322: Flags [R], seq 1788119857, win 0, length 0
20:24:00.918939 eth0  Out IP 10.14.166.201.55256 > 10.0.0.227.322: Flags [S], seq 2884746582, win 64240, options [mss 1460,sackOK,TS val 1539408254 ecr 0,nop,wscale 7], length 0
20:24:00.924749 eth0  In  IP 10.0.0.227.322 > 10.14.166.201.55256: Flags [S.], seq 3743655587, ack 2884746583, win 43440, options [mss 1460,sackOK,TS val 4279557058 ecr 1539408254,nop,wscale 8], length 0
20:24:00.924761 eth0  Out IP 10.14.166.201.55256 > 10.0.0.227.322: Flags [.], ack 1, win 502, options [nop,nop,TS val 1539408260 ecr 4279557058], length 0
20:24:00.925251 eth0  Out IP 10.14.166.201.55256 > 10.0.0.227.322: Flags [P.], seq 1:1556, ack 1, win 502, options [nop,nop,TS val 1539408260 ecr 4279557058], length 1555
20:24:00.930193 eth0  In  IP 10.0.0.227.322 > 10.14.166.201.55256: Flags [.], ack 1449, win 165, options [nop,nop,TS val 4279557063 ecr 1539408260], length 0
20:24:00.930518 eth0  In  IP 10.0.0.227.322 > 10.14.166.201.55256: Flags [.], ack 1556, win 165, options [nop,nop,TS val 4279557064 ecr 1539408260], length 0
20:24:05.180886 eth0  Out IP 10.14.166.201.41542 > 10.0.0.227.322: Flags [F.], seq 1556, ack 1, win 502, options [nop,nop,TS val 1539412516 ecr 4279551325], length 0
20:24:05.227563 eth0  In  IP 10.0.0.227.322 > 10.14.166.201.41542: Flags [.], ack 1557, win 165, options [nop,nop,TS val 4279561358 ecr 1539412516], length 0
20:24:05.648579 eth0  In  IP 10.0.0.227.322 > 10.14.166.201.54384: Flags [.], ack 2287138624, win 165, options [nop,nop,TS val 4279561779 ecr 1539232918], length 0
20:24:05.648598 eth0  Out IP 10.14.166.201.54384 > 10.0.0.227.322: Flags [R], seq 2287138624, win 0, length 0
20:24:10.918220 eth0  Out IP 10.14.166.201.55256 > 10.0.0.227.322: Flags [F.], seq 1556, ack 1, win 502, options [nop,nop,TS val 1539418253 ecr 4279557064], length 0
20:24:10.967975 eth0  In  IP 10.0.0.227.322 > 10.14.166.201.55256: Flags [.], ack 1557, win 165, options [nop,nop,TS val 4279567097 ecr 1539418253], length 0
20:24:11.248552 eth0  Out IP 10.14.166.201.57902 > 10.0.0.227.322: Flags [S], seq 1702848317, win 64240, options [mss 1460,sackOK,TS val 1539418584 ecr 0,nop,wscale 7], length 0
20:24:11.253466 eth0  In  IP 10.0.0.227.322 > 10.14.166.201.57902: Flags [S.], seq 1214185415, ack 1702848318, win 43440, options [mss 1460,sackOK,TS val 4279567387 ecr 1539418584,nop,wscale 8], length 0
20:24:11.253487 eth0  Out IP 10.14.166.201.57902 > 10.0.0.227.322: Flags [.], ack 1, win 502, options [nop,nop,TS val 1539418589 ecr 4279567387], length 0
20:24:11.254529 eth0  Out IP 10.14.166.201.57902 > 10.0.0.227.322: Flags [P.], seq 1:1556, ack 1, win 502, options [nop,nop,TS val 1539418590 ecr 4279567387], length 1555
20:24:11.259320 eth0  In  IP 10.0.0.227.322 > 10.14.166.201.57902: Flags [.], ack 1449, win 165, options [nop,nop,TS val 4279567393 ecr 1539418590], length 0
20:24:11.259645 eth0  In  IP 10.0.0.227.322 > 10.14.166.201.57902: Flags [.], ack 1556, win 165, options [nop,nop,TS val 4279567393 ecr 1539418590], length 0
20:24:13.840580 eth0  In  IP 10.0.0.227.322 > 10.14.166.201.45134: Flags [.], ack 831461443, win 165, options [nop,nop,TS val 4279569971 ecr 1539240801], length 0
20:24:13.840598 eth0  Out IP 10.14.166.201.45134 > 10.0.0.227.322: Flags [R], seq 831461443, win 0, length 0
20:24:15.377557 eth0  In  IP 10.0.0.227.322 > 10.14.166.201.45140: Flags [.], ack 821956702, win 165, options [nop,nop,TS val 4279571508 ecr 1539242638], length 0
20:24:15.377572 eth0  Out IP 10.14.166.201.45140 > 10.0.0.227.322: Flags [R], seq 821956702, win 0, length 0
20:24:17.425498 eth0  In  IP 10.0.0.227.322 > 10.14.166.201.40390: Flags [.], ack 769375607, win 165, options [nop,nop,TS val 4279573556 ecr 1539244648], length 0
20:24:17.425513 eth0  Out IP 10.14.166.201.40390 > 10.0.0.227.322: Flags [R], seq 769375607, win 0, length 0
^C
69 packets captured
71 packets received by filter
0 packets dropped by kernel
```
  
</details>

[bambuddy-support-20260410-202439.zip](https://github.com/user-attachments/files/26641745/bambuddy-support-20260410-202439.zip)

**To Reproduce**
1. Install and set up Bambuddy
2. Start a print that's at least an hour long
3. Connect to X1C's camera from Bambuddy
4. After 30 minutes or so, Bambuddy loses the camera's connection and can't connect back to the camera again until X1C is rebooted.

**Expected behavior**
The camera should be able to maintain a connection without hanging for far longer than 30 minutes.

**Screenshots/Photos**
If applicable, add screenshots or photos to help explain your problem.

**External Links**
(https://github.com/maziggy/bambuddy/issues/925)

**Additional Details:**
 - Printer type (X1/X1C/X1E): X1C
 - X1Plus version: 3.1
 - AP firmware version: 00.00.32.39
 - AP hardware revision: Not sure how to find this
 - MC firmware version: 00.00.27.26
 - MC hardware revision: Not sure how to find this
 - Toolhead firmware version: 00.00.07.12
 - Toolhead hardware revision: Not sure how to find this
 - Computer vision model:

**Is the bug present on OEM firmware?**
This bug does not appear to be present in the OEM firmware as no one else has reported this issue yet.

**Custom modifications**
Add details of any software or electronic modifications you've made to your printer here.

**Additional context**

**Comment by mikefromdot** [comment]
iirc there is a documented problem with the BBL ipcam implementation that locks up the camera until a restart. 
A watchdog that restarts the service when it cant probe it should work? Not sure if the printer really likes doing that though. 

I'll test that on my idle x1

**Comment by mikefromdot** [comment]
ok so I did manage to reset the ipcam live, and then proceeded to bang my head against the wall as it shut off rstp when I live restarted it.

I figured that out and am running a test build now that auto runs a watchdog every 5ish minutes, if it detects that the ipcam is hung it restarts it and clears out the stale sessions.

I am going to run it for a bit and see if 
a. Bambuddy continuously can stream for longer than 30 minutes, without the camera crashing or needing reboot.
b. the watchdog restarts the process if it does hang.

If you'd like to try it as well before I open a PR for review you are more than welcome to, Github is not very friendly with the file so I can shoot you the file via the discord if you'd like. Just tag Bush Rick in the discord in the CFW channel

**Comment by lightmaster** [comment]
Just sent you a message on Discord.

So with clearing out stale sessions, it should prevent Bambuddy from dropping the camera feed at all then, right?

**Comment by mikefromdot** [comment]
In theory it should as it restarts the whole service and toggles the rstp back on, my only hang up with how it is now is that it _may_ force rstp to be on 100% of the time.

Thats another thing that I want to verify but for now I just want it to refresh the process when it gets ornery.

edit: Well good news for me is that if you shut off rstp it stays off. Bad news is that it makes the watchdog trigger and try to restart it (it doesnt but it prints out angry messages in logs)

**Comment by mikefromdot** [comment]
Tested the build for a few hours and it seems to pick up when the camera fails, previous worry of logging issue did not present. Created a PR and is awaiting review.

**Comment by jwise** [comment]
Whoah, sweet.  I need to read this PR.  I'm in the middle of moving across the country so I'm kind of low on X1Plus bandwidth right now but it's exciting to have a PR to review!  ipcam is a super unstable service in general that often could benefit from being kicked.

**Comment by mikefromdot** [comment]
np, 
Really would appreciate feedback tis my first code foray and ngl I did kinda cheat and have claude check it all as i was going lol

**Comment by lightmaster** [comment]
I'm about to start a 5 hour print, will see if the camera will stay active for the entire time.

**Comment by mikefromdot** [comment]
If you are able to please ssh to the printer during the print and keep an keep an eye on it during the print.

tail -f /tmp/syslog.log | grep -i "camera\|liveview\|rtsp\|watchdog\|x1plus\|restore"

this should tell you if the watchdog is firing when ipcam locks up.

Just post the output in here

**Comment by lightmaster** [comment]
About 45 mins into the print and this is what I have from that command so far:
<details>
<summary>syslog.log</summary>

```
26 Apr 14 22:52:58 warn x1plus.services.x1plusd.modules.camera_watchdog: camera RTSP probe failed: 
26 Apr 14 22:52:58 warn x1plus.services.x1plusd.modules.camera_watchdog: restarting ipcam service (RTSP was enabled)
26 Apr 14 22:53:03 info x1plus.services.x1plusd.modules.camera_watchdog: ipcam service restarted successfully
26 Apr 14 22:53:03 info x1plus.services.x1plusd.modules.camera_watchdog: waiting 8s for ipcam to settle before restoring RTSP state
26 Apr 14 22:53:04 info ipcam[1561]: created topic handle for: camera
26 Apr 14 22:53:04 info ipcam[1561]: created topic handle for: liveview
26 Apr 14 22:53:05 err ipcam[1561]: topic: device/inter/report/ipcam  reply :{"ipcam":{"ipcam":{"agora_service":"disable","ipcam_dev":"1","ipcam_record":"disable","mode_bits":2,"resolution":"1080p","rtsp_url":"disable","timelapse":"disable","tutk_server":"disable"},"liveviewing":false,"recording":0}} Failed
26 Apr 14 22:53:05 err ipcam[1561]: [ipcam_status_report_task][692] publish message:{"ipcam":{"ipcam":{"agora_service":"disable","ipcam_dev":"1","ipcam_record":"disable","mode_bits":2,"resolution":"1080p","rtsp_url":"disable","timelapse":"disable","tutk_server":"disable"},"liveviewing":false,"recording":0}} Failed
26 Apr 14 22:53:06 info ipcam[1561]: [create_soft_guard_flow][196] softguard flow param: name=softguard thread_model=sync input_model=dropcurrent input_data_type= output_data_type=  bbl_sg_name=liveview bbl_sg_default_disable=disable bbl_sg_av_skip_check=enable
26 Apr 14 22:53:06 info ipcam[1561]: [SoftGuard][44] [flow] enter SoftGuard construct parm: bbl_sg_name=liveview bbl_sg_default_disable=disable bbl_sg_av_skip_check=enable
26 Apr 14 22:53:06 info ipcam[1561]: [SoftGuard][93] SoftGuard name:liveview default pass: 0 interval: 0 open_proc_statistic:0 statistic_interval:120
26 Apr 14 22:53:06 info ipcam[1561]: [create_liveview_flow:625] f_live create liveview flow success. tutk:0, agora:0
26 Apr 14 22:53:06 info ipcam[1561]: [l_monitor_thread_loop:537] f_live src/flow/flow_liveview.cpp: code arrive here.
26 Apr 14 22:53:06 info ipcam[1561]: [IoCtrl][150] liveview softguard pass set 1
26 Apr 14 22:53:06 info ipcam[1561]: [flow_liveview_enable:683] f_live [tutk] liveview enable:1
26 Apr 14 22:53:06 info ipcam[1561]: [IoCtrl][150] liveview softguard pass set 0
26 Apr 14 22:53:06 info ipcam[1561]: [flow_liveview_enable:683] f_live [tutk] liveview enable:0
26 Apr 14 22:53:07 info ipcam[1561]: [IoCtrl][150] liveview softguard pass set 1
26 Apr 14 22:53:07 info ipcam[1561]: [flow_liveview_enable:683] f_live [tutk] liveview enable:1
26 Apr 14 22:53:07 debug bbl_screen: ipcam syncingrtsp: false
26 Apr 14 22:53:08 info x1plus.services.x1plusd.mcproto: MC message: <MCMessage RSP #651 AP -> MC: <M971 seq 519, C0 O0 P0, response 0>>
26 Apr 14 22:53:08 info x1plus.services.x1plusd.mcproto: MC message: <MCMessage REQ #1133 MC -> AP: <M971 seq 519, C10 O0 P0, response None>>
26 Apr 14 22:53:11 info x1plus.services.x1plusd.modules.camera_watchdog: RTSP not enabled (rtsp_url='disable'), requesting restore via bbl_screen (attempt 1/3)
26 Apr 14 22:53:11 debug bbl_screen: device/x1plus [object Object]
26 Apr 14 22:53:11 debug bbl_screen: [x1p] camera_watchdog: restoring RTSP server to true
26 Apr 14 22:53:12 debug bbl_screen: BBLPrinter::publishMessage "liveview" "{\"command\":\"liveview\",\"op_protocols\":[{\"command\":\"init\",\"media_port\":322,\"passwd\":\"********\",\"server_use_tls\":1,\"streams_cfg\":\"default\",\"type\":\"rtsp\",\"username\":\"bblp\"}],\"peer_host\":\"bbl_screen\",\"sequence_id\":\"62\",\"version\":1}"
26 Apr 14 22:53:12 info ipcam[1561]: [liveview_bcsm_handler][21] Got bcsm operate reuqire from:bbl_screen
26 Apr 14 22:53:12 info ipcam[1561]: [liveview_bcsm_handler][144] Enable rtsp over tls.
26 Apr 14 22:53:12 info ipcam[1561]: src/flow/flow_liveview.cpp : create_bcsm_flow: 462
26 Apr 14 22:53:12 info ipcam[1561]: [RKMEDIA][RTSP_BBL][RtspServerFlow:123] live555/server/rtsp_server.cc : RtspServerFlow: 123
26 Apr 14 22:53:12 info ipcam[1561]: [RKMEDIA][RTSP_BBL][getInstanceMultiServer:68] getInstanceMultiServer: new server(bbl_rtsp_server), create new ok.
26 Apr 14 22:53:12 info ipcam[1561]: [RKMEDIA][RTSP_BBL][service_session_run:121] ================ service_session_run =================
26 Apr 14 22:53:12 info ipcam[1561]: [RKMEDIA][RTSP_BBL][sendMessage:270] sendMessage: before mtx.wait.
26 Apr 14 22:53:12 info ipcam[1561]: [RKMEDIA][RTSP_BBL][CheckEndlAndLog:65] Play this stream using the URL: 	rtsps://10.0.0.227/streaming/live/1
26 Apr 14 22:53:12 info ipcam[1561]: [RKMEDIA][RTSP_BBL][addSession:247]  addSession : no audio. audioType =  
26 Apr 14 22:53:12 info ipcam[1561]: [RKMEDIA][RTSP_BBL][CheckEndlAndLog:65] success.
26 Apr 14 22:53:12 info ipcam[1561]: [RKMEDIA][RTSP_BBL][incomingMsgHandler1:180] incomingMsgHandler1: before mtx.notify
26 Apr 14 22:53:12 info ipcam[1561]: [RKMEDIA][RTSP_BBL][incomingMsgHandler1:185] incomingMsgHandler1: after mtx.notify
26 Apr 14 22:53:12 info ipcam[1561]: [RKMEDIA][RTSP_BBL][sendMessage:276] sendMessage: after mtx.wait.
26 Apr 14 22:53:12 info ipcam[1561]: [RKMEDIA][RTSP_BBL][RtspServerFlow:216] live555/server/rtsp_server.cc : RtspServerFlow: 216
26 Apr 14 22:53:12 info ipcam[1561]: [create_rtsp_server_flow:445] f_live create rtsp_flow ok
26 Apr 14 22:53:12 info ipcam[1561]: [RtspServerOpenTrackerSend:295] ok
26 Apr 14 22:53:12 info ipcam[1561]: [liveview_bcsm_handler][178] handle op_protocols rtsp init success.
26 Apr 14 22:53:12 debug bbl_screen: setRtspServer on info "{\"op_protocols\": [{\"command\": \"init\",\"result\": \"success\",\"streams\": [{\"item_id\": 0,\"tracks\": [{\"codec_type\": \"h264\",\"item_id\": 0,\"resolution\": \"1920x1080\",\"type\": \"video\"}],\"url\": \"rtsps://10.0.0.227:322/streaming/live/1\"}]}],\"peer_host\": \"ipcam\",\"result\": \"success\",\"sequence_id\": \"62\",\"version\": 1}"
26 Apr 14 22:53:12 debug bbl_screen: DeviceManager::putSetting sync printer.json "rtspServer" QVariant(bool, true)
26 Apr 14 22:53:14 debug bbl_screen: ipcam syncingrtsp: false
26 Apr 14 22:53:16 info x1plus.services.x1plusd.modules.camera_watchdog: RTSP server is enabled (rtsp_url='rtsps://10.0.0.227:322/streaming/live/1') — restore complete
26 Apr 14 22:53:18 info ipcam[1561]: [RKMEDIA][RTSP_BBL][createNewStreamSource:146] live555/server/h264_server_media_subsession.cc:createNewStreamSource:0x9f906218 - clientSessionId: 0x00000000
26 Apr 14 22:53:18 info ipcam[1561]: [RKMEDIA][RTSP_BBL][Source:284] Source :: 0x9f912d28 wakeFds[0] = -1, wakeFds[1]= -1.
26 Apr 14 22:53:18 info ipcam[1561]: [RKMEDIA][RTSP_BBL][createNewStreamSource:155] h264 framedsource : 0x9f90ac08, estBitrate = 1000 
26 Apr 14 22:53:18 info ipcam[1561]: [RKMEDIA][RTSP_BBL][createNewRTPSink:167] live555/server/h264_server_media_subsession.cc : createNewRTPSink: 167
26 Apr 14 22:53:18 info ipcam[1561]: [RKMEDIA][RTSP_BBL][createNewRTPSink:170] h264 rtp sink : 0x9f90ae30
26 Apr 14 22:53:18 info ipcam[1561]: [RtspHandlePlayVideo][320] get PlayVideo callback.
26 Apr 14 22:53:18 info ipcam[1561]: [RKMEDIA][RTSP_BBL][checkForAuxSDPLine1:112] live555/server/h264_server_media_subsession.cc : checkForAuxSDPLine1: 112
26 Apr 14 22:53:18 info ipcam[1561]: [RKMEDIA][RTSP_BBL][doStopGettingFrames:355] live555/server/live555_media_input.cc : doStopGettingFrames: 355
26 Apr 14 22:53:18 info ipcam[1561]: [RKMEDIA][RTSP_BBL][doStopGettingFrames:355] live555/server/live555_media_input.cc : doStopGettingFrames: 355
26 Apr 14 22:53:18 info ipcam[1561]: [RKMEDIA][RTSP_BBL][~VideoFramedSource:389] live555/server/live555_media_input.cc : ~VideoFramedSource: 389
26 Apr 14 22:53:18 info ipcam[1561]: [RKMEDIA][RTSP_BBL][~Source:303] ~Source::0x9f912d28 remain 0 buffers, will auto release
26 Apr 14 22:53:18 info ipcam[1561]: [RKMEDIA][RTSP_BBL][createNewStreamSource:146] live555/server/h264_server_media_subsession.cc:createNewStreamSource:0x9f906218 - clientSessionId: 0x78359317
26 Apr 14 22:53:18 info ipcam[1561]: [RKMEDIA][RTSP_BBL][Source:284] Source :: 0x9f90bcc8 wakeFds[0] = -1, wakeFds[1]= -1.
26 Apr 14 22:53:18 info ipcam[1561]: [RKMEDIA][RTSP_BBL][createNewStreamSource:155] h264 framedsource : 0x9f90ac08, estBitrate = 4510 
26 Apr 14 22:53:18 info ipcam[1561]: [RKMEDIA][RTSP_BBL][createNewRTPSink:167] live555/server/h264_server_media_subsession.cc : createNewRTPSink: 167
26 Apr 14 22:53:18 info ipcam[1561]: [RKMEDIA][RTSP_BBL][createNewRTPSink:170] h264 rtp sink : 0x9f90ae30
26 Apr 14 22:53:18 info ipcam[1561]: [RtspHandlePlayVideo][320] get PlayVideo callback.
26 Apr 14 22:53:18 info ipcam[1561]: [RKMEDIA][RTSP_BBL][Start:60] live555/server/live555_media_input.cc : Start: 60
26 Apr 14 22:53:18 info ipcam[1561]: [RKMEDIA][RTSP_BBL][startStream:57] live555/server/h264_server_media_subsession.cc:startStream:0x9f906218 - clientSessionId: 0x78359317
26 Apr 14 22:53:20 info ipcam[1561]: [RKMEDIA][RTSP_BBL][deleteStream:64] deleteStream - clientSessionId: 0x78359317
26 Apr 14 22:53:20 info ipcam[1561]: [RKMEDIA][RTSP_BBL][Stop:65] live555/server/live555_media_input.cc : Stop: 65
26 Apr 14 22:53:20 info ipcam[1561]: [RtspHandleStopVideo][338] get StopVideo callback.
26 Apr 14 22:53:20 info ipcam[1561]: [RKMEDIA][RTSP_BBL][doStopGettingFrames:355] live555/server/live555_media_input.cc : doStopGettingFrames: 355
26 Apr 14 22:53:20 info ipcam[1561]: [RKMEDIA][RTSP_BBL][doStopGettingFrames:355] live555/server/live555_media_input.cc : doStopGettingFrames: 355
26 Apr 14 22:53:20 info ipcam[1561]: [RKMEDIA][RTSP_BBL][~VideoFramedSource:389] live555/server/live555_media_input.cc : ~VideoFramedSource: 389
26 Apr 14 22:53:20 info ipcam[1561]: [RKMEDIA][RTSP_BBL][createNewStreamSource:146] live555/server/h264_server_media_subsession.cc:createNewStreamSource:0x9f906218 - clientSessionId: 0xbf2241d8
26 Apr 14 22:53:20 info ipcam[1561]: [RKMEDIA][RTSP_BBL][Source:284] Source :: 0x9f90c250 wakeFds[0] = -1, wakeFds[1]= -1.
26 Apr 14 22:53:20 info ipcam[1561]: [RKMEDIA][RTSP_BBL][createNewStreamSource:155] h264 framedsource : 0x9f90ac08, estBitrate = 5381 
26 Apr 14 22:53:20 info ipcam[1561]: [RKMEDIA][RTSP_BBL][createNewRTPSink:167] live555/server/h264_server_media_subsession.cc : createNewRTPSink: 167
26 Apr 14 22:53:20 info ipcam[1561]: [RKMEDIA][RTSP_BBL][createNewRTPSink:170] h264 rtp sink : 0x9f90ae30
26 Apr 14 22:53:20 info ipcam[1561]: [RtspHandlePlayVideo][320] get PlayVideo callback.
26 Apr 14 22:53:20 info ipcam[1561]: [RKMEDIA][RTSP_BBL][Start:60] live555/server/live555_media_input.cc : Start: 60
26 Apr 14 22:53:20 info ipcam[1561]: [RKMEDIA][RTSP_BBL][startStream:57] live555/server/h264_server_media_subsession.cc:startStream:0x9f906218 - clientSessionId: 0xbf2241d8
26 Apr 14 22:53:20 info ipcam[1561]: [RKMEDIA][RTSP_BBL][~Source:303] ~Source::0x9f90bcc8 remain 0 buffers, will auto release
26 Apr 14 22:53:58 info x1plus.services.x1plusd.mcproto: MC message: <MCMessage RSP #1425 AP -> MC: <M971 seq 520, C0 O0 P0, response 0>>
26 Apr 14 22:53:58 info x1plus.services.x1plusd.mcproto: MC message: <MCMessage REQ #1135 MC -> AP: <M971 seq 520, C10 O0 P0, response None>>
26 Apr 14 22:54:50 info x1plus.services.x1plusd.mcproto: MC message: <MCMessage RSP #2227 AP -> MC: <M971 seq 521, C0 O0 P0, response 0>>
26 Apr 14 22:54:50 info x1plus.services.x1plusd.mcproto: MC message: <MCMessage REQ #1137 MC -> AP: <M971 seq 521, C10 O0 P0, response None>>
26 Apr 14 22:55:44 info x1plus.services.x1plusd.mcproto: MC message: <MCMessage RSP #3070 AP -> MC: <M971 seq 522, C0 O0 P0, response 0>>
26 Apr 14 22:55:44 info x1plus.services.x1plusd.mcproto: MC message: <MCMessage REQ #1139 MC -> AP: <M971 seq 522, C10 O0 P0, response None>>
26 Apr 14 22:56:06 info bbl_watchdog: in watchdog mainloop
26 Apr 14 22:56:08 info forward[1629]: usb camera online is 1
26 Apr 14 22:56:41 info x1plus.services.x1plusd.mcproto: MC message: <MCMessage RSP #3948 AP -> MC: <M971 seq 523, C0 O0 P0, response 0>>
26 Apr 14 22:56:41 info x1plus.services.x1plusd.mcproto: MC message: <MCMessage REQ #1141 MC -> AP: <M971 seq 523, C10 O0 P0, response None>>
26 Apr 14 22:57:16 info ipcam[1561]: [RKMEDIA][RTSP_BBL][deleteStream:64] deleteStream - clientSessionId: 0xbf2241d8
26 Apr 14 22:57:16 info ipcam[1561]: [RKMEDIA][RTSP_BBL][Stop:65] live555/server/live555_media_input.cc : Stop: 65
26 Apr 14 22:57:16 info ipcam[1561]: [RtspHandleStopVideo][338] get StopVideo callback.
26 Apr 14 22:57:16 info ipcam[1561]: [RKMEDIA][RTSP_BBL][doStopGettingFrames:355] live555/server/live555_media_input.cc : doStopGettingFrames: 355
26 Apr 14 22:57:16 info ipcam[1561]: [RKMEDIA][RTSP_BBL][doStopGettingFrames:355] live555/server/live555_media_input.cc : doStopGettingFrames: 355
26 Apr 14 22:57:16 info ipcam[1561]: [RKMEDIA][RTSP_BBL][~VideoFramedSource:389] live555/server/live555_media_input.cc : ~VideoFramedSource: 389
26 Apr 14 22:57:16 info ipcam[1561]: [RKMEDIA][RTSP_BBL][~Source:303] ~Source::0x9f90c250 remain 0 buffers, will auto release
26 Apr 14 22:57:16 info ipcam[1561]: [RKMEDIA][RTSP_BBL][createNewStreamSource:146] live555/server/h264_server_media_subsession.cc:createNewStreamSource:0x9f906218 - clientSessionId: 0x63b919fa
26 Apr 14 22:57:16 info ipcam[1561]: [RKMEDIA][RTSP_BBL][Source:284] Source :: 0x9f9083a8 wakeFds[0] = -1, wakeFds[1]= -1.
26 Apr 14 22:57:16 info ipcam[1561]: [RKMEDIA][RTSP_BBL][createNewStreamSource:155] h264 framedsource : 0x9f90ac08, estBitrate = 8758 
26 Apr 14 22:57:16 info ipcam[1561]: [RKMEDIA][RTSP_BBL][createNewRTPSink:167] live555/server/h264_server_media_subsession.cc : createNewRTPSink: 167
26 Apr 14 22:57:16 info ipcam[1561]: [RKMEDIA][RTSP_BBL][createNewRTPSink:170] h264 rtp sink : 0x9f90ae30
26 Apr 14 22:57:16 info ipcam[1561]: [RtspHandlePlayVideo][320] get PlayVideo callback.
26 Apr 14 22:57:16 info ipcam[1561]: [RKMEDIA][RTSP_BBL][Start:60] live555/server/live555_media_input.cc : Start: 60
26 Apr 14 22:57:16 info ipcam[1561]: [RKMEDIA][RTSP_BBL][startStream:57] live555/server/h264_server_media_subsession.cc:startStream:0x9f906218 - clientSessionId: 0x63b919fa
26 Apr 14 22:57:42 info x1plus.services.x1plusd.mcproto: MC message: <MCMessage REQ #1143 MC -> AP: <M971 seq 524, C10 O0 P0, response None>>
26 Apr 14 22:57:42 info x1plus.services.x1plusd.mcproto: MC message: <MCMessage RSP #818 AP -> MC: <M971 seq 524, C0 O0 P0, response 0>>
26 Apr 14 22:58:37 info x1plus.services.x1plusd.mcproto: MC message: <MCMessage RSP #1661 AP -> MC: <M971 seq 525, C0 O0 P0, response 0>>
26 Apr 14 22:58:37 info x1plus.services.x1plusd.mcproto: MC message: <MCMessage REQ #1145 MC -> AP: <M971 seq 525, C10 O0 P0, response None>>
26 Apr 14 22:59:30 info x1plus.services.x1plusd.mcproto: MC message: <MCMessage RSP #2491 AP -> MC: <M971 seq 526, C0 O0 P0, response 0>>
26 Apr 14 22:59:30 info x1plus.services.x1plusd.mcproto: MC message: <MCMessage REQ #1147 MC -> AP: <M971 seq 526, C10 O0 P0, response None>>
26 Apr 14 23:00:27 info x1plus.services.x1plusd.mcproto: MC message: <MCMessage RSP #3385 AP -> MC: <M971 seq 527, C0 O0 P0, response 0>>
26 Apr 14 23:00:27 info x1plus.services.x1plusd.mcproto: MC message: <MCMessage REQ #1149 MC -> AP: <M971 seq 527, C10 O0 P0, response None>>
26 Apr 14 23:01:24 info x1plus.services.x1plusd.mcproto: MC message: <MCMessage RSP #173 AP -> MC: <M971 seq 528, C0 O0 P0, response 0>>
26 Apr 14 23:01:24 info x1plus.services.x1plusd.mcproto: MC message: <MCMessage REQ #1151 MC -> AP: <M971 seq 528, C10 O0 P0, response None>>
26 Apr 14 23:02:19 info x1plus.services.x1plusd.mcproto: MC message: <MCMessage RSP #1015 AP -> MC: <M971 seq 529, C0 O0 P0, response 0>>
26 Apr 14 23:02:19 info x1plus.services.x1plusd.mcproto: MC message: <MCMessage REQ #1153 MC -> AP: <M971 seq 529, C10 O0 P0, response None>>
26 Apr 14 23:03:22 info x1plus.services.x1plusd.mcproto: MC message: <MCMessage RSP #1996 AP -> MC: <M971 seq 530, C0 O0 P0, response 0>>
26 Apr 14 23:03:22 info x1plus.services.x1plusd.mcproto: MC message: <MCMessage REQ #1155 MC -> AP: <M971 seq 530, C10 O0 P0, response None>>
26 Apr 14 23:04:25 info x1plus.services.x1plusd.mcproto: MC message: <MCMessage RSP #2973 AP -> MC: <M971 seq 531, C0 O0 P0, response 0>>
26 Apr 14 23:04:26 info x1plus.services.x1plusd.mcproto: MC message: <MCMessage REQ #1157 MC -> AP: <M971 seq 531, C10 O0 P0, response None>>
26 Apr 14 23:05:31 info x1plus.services.x1plusd.mcproto: MC message: <MCMessage RSP #3991 AP -> MC: <M971 seq 532, C0 O0 P0, response 0>>
26 Apr 14 23:05:31 info x1plus.services.x1plusd.mcproto: MC message: <MCMessage REQ #1159 MC -> AP: <M971 seq 532, C10 O0 P0, response None>>
26 Apr 14 23:06:06 info bbl_watchdog: in watchdog mainloop
26 Apr 14 23:06:08 info forward[1629]: usb camera online is 1
26 Apr 14 23:06:36 info x1plus.services.x1plusd.mcproto: MC message: <MCMessage RSP #893 AP -> MC: <M971 seq 533, C0 O0 P0, response 0>>
26 Apr 14 23:06:36 info x1plus.services.x1plusd.mcproto: MC message: <MCMessage REQ #1161 MC -> AP: <M971 seq 533, C10 O0 P0, response None>>
26 Apr 14 23:07:38 info x1plus.services.x1plusd.mcproto: MC message: <MCMessage REQ #1163 MC -> AP: <M971 seq 534, C10 O0 P0, response None>>
26 Apr 14 23:07:39 info x1plus.services.x1plusd.mcproto: MC message: <MCMessage RSP #1854 AP -> MC: <M971 seq 534, C0 O0 P0, response 0>>
26 Apr 14 23:08:40 info x1plus.services.x1plusd.mcproto: MC message: <MCMessage RSP #2799 AP -> MC: <M971 seq 535, C0 O0 P0, response 0>>
26 Apr 14 23:08:40 info x1plus.services.x1plusd.mcproto: MC message: <MCMessage REQ #1165 MC -> AP: <M971 seq 535, C10 O0 P0, response None>>
26 Apr 14 23:09:40 info x1plus.services.x1plusd.mcproto: MC message: <MCMessage RSP #3730 AP -> MC: <M971 seq 536, C0 O0 P0, response 0>>
26 Apr 14 23:09:40 info x1plus.services.x1plusd.mcproto: MC message: <MCMessage REQ #1167 MC -> AP: <M971 seq 536, C10 O0 P0, response None>>
26 Apr 14 23:10:41 info x1plus.services.x1plusd.mcproto: MC message: <MCMessage REQ #1169 MC -> AP: <M971 seq 537, C10 O0 P0, response None>>
26 Apr 14 23:10:41 info x1plus.services.x1plusd.mcproto: MC message: <MCMessage RSP #591 AP -> MC: <M971 seq 537, C0 O0 P0, response 0>>
26 Apr 14 23:11:41 info x1plus.services.x1plusd.mcproto: MC message: <MCMessage RSP #1534 AP -> MC: <M971 seq 538, C0 O0 P0, response 0>>
26 Apr 14 23:11:41 info x1plus.services.x1plusd.mcproto: MC message: <MCMessage REQ #1171 MC -> AP: <M971 seq 538, C10 O0 P0, response None>>
26 Apr 14 23:12:17 info ipcam[1561]: [RtspHandlePlayVideo][320] get PlayVideo callback.
26 Apr 14 23:12:17 info ipcam[1561]: [RKMEDIA][RTSP_BBL][startStream:57] live555/server/h264_server_media_subsession.cc:startStream:0x9f906218 - clientSessionId: 0xa61bd71e
26 Apr 14 23:12:20 info ipcam[1561]: [RKMEDIA][RTSP_BBL][deleteStream:64] deleteStream - clientSessionId: 0x63b919fa
26 Apr 14 23:12:41 info x1plus.services.x1plusd.mcproto: MC message: <MCMessage RSP #2473 AP -> MC: <M971 seq 539, C0 O0 P0, response 0>>
26 Apr 14 23:12:41 info x1plus.services.x1plusd.mcproto: MC message: <MCMessage REQ #1173 MC -> AP: <M971 seq 539, C10 O0 P0, response None>>
26 Apr 14 23:13:42 info x1plus.services.x1plusd.mcproto: MC message: <MCMessage RSP #3438 AP -> MC: <M971 seq 540, C0 O0 P0, response 0>>
26 Apr 14 23:13:42 info x1plus.services.x1plusd.mcproto: MC message: <MCMessage REQ #1175 MC -> AP: <M971 seq 540, C10 O0 P0, response None>>
26 Apr 14 23:14:42 info x1plus.services.x1plusd.mcproto: MC message: <MCMessage REQ #1177 MC -> AP: <M971 seq 541, C10 O0 P0, response None>>
26 Apr 14 23:14:42 info x1plus.services.x1plusd.mcproto: MC message: <MCMessage RSP #286 AP -> MC: <M971 seq 541, C0 O0 P0, response 0>>
26 Apr 14 23:15:43 info x1plus.services.x1plusd.mcproto: MC message: <MCMessage RSP #1225 AP -> MC: <M971 seq 542, C0 O0 P0, response 0>>
26 Apr 14 23:15:43 info x1plus.services.x1plusd.mcproto: MC message: <MCMessage REQ #1179 MC -> AP: <M971 seq 542, C10 O0 P0, response None>>
26 Apr 14 23:16:06 info bbl_watchdog: in watchdog mainloop
26 Apr 14 23:16:09 info forward[1629]: usb camera online is 1
26 Apr 14 23:16:43 info x1plus.services.x1plusd.mcproto: MC message: <MCMessage RSP #2174 AP -> MC: <M971 seq 543, C0 O0 P0, response 0>>
26 Apr 14 23:16:43 info x1plus.services.x1plusd.mcproto: MC message: <MCMessage REQ #1181 MC -> AP: <M971 seq 543, C10 O0 P0, response None>>
26 Apr 14 23:17:45 info x1plus.services.x1plusd.mcproto: MC message: <MCMessage REQ #1183 MC -> AP: <M971 seq 544, C10 O0 P0, response None>>
26 Apr 14 23:17:46 info x1plus.services.x1plusd.mcproto: MC message: <MCMessage RSP #3153 AP -> MC: <M971 seq 5
```
</details>

**Comment by mikefromdot** [comment]
looks like it did fire off. Any issues with it once it did?

Did you notice bambuddy doing anythign when it did (mainly reconnecting the camera)?

**Comment by lightmaster** [comment]
Yea, camera feed shut off for 10 seconds or so. Seems a bit lower quality afterwards, like it went to 720p instead of the 1080p it was set to before, but that could just be me imagining things.

**Comment by mikefromdot** [comment]
Odd, the camera in the x1 is pretty bad so it may be that.

Good to know that it IS working correctly though.

I think this also may fix the BBS and Orca problem where the feed cuts off too, I'm running a print now and studio hasnt disconnected like it usually does

**Comment by lightmaster** [comment]
Camera kept going for the whole print.

<details>

<summary>syslog.log</summary>

```bash
[root@BL-P001-sdcard:~]# cat /sdcard/camera.log
26 Apr 14 22:52:58 warn x1plus.services.x1plusd.modules.camera_watchdog: camera RTSP probe failed: 
26 Apr 14 22:52:58 warn x1plus.services.x1plusd.modules.camera_watchdog: restarting ipcam service (RTSP was enabled)
26 Apr 14 22:53:03 info x1plus.services.x1plusd.modules.camera_watchdog: ipcam service restarted successfully
26 Apr 14 22:53:03 info x1plus.services.x1plusd.modules.camera_watchdog: waiting 8s for ipcam to settle before restoring RTSP state
26 Apr 14 22:53:04 info ipcam[1561]: created topic handle for: camera
26 Apr 14 22:53:04 info ipcam[1561]: created topic handle for: liveview
26 Apr 14 22:53:05 err ipcam[1561]: topic: device/inter/report/ipcam  reply :{"ipcam":{"ipcam":{"agora_service":"disable","ipcam_dev":"1","ipcam_record":"disable","mode_bits":2,"resolution":"1080p","rtsp_url":"disable","timelapse":"disable","tutk_server":"disable"},"liveviewing":false,"recording":0}} Failed
26 Apr 14 22:53:05 err ipcam[1561]: [ipcam_status_report_task][692] publish message:{"ipcam":{"ipcam":{"agora_service":"disable","ipcam_dev":"1","ipcam_record":"disable","mode_bits":2,"resolution":"1080p","rtsp_url":"disable","timelapse":"disable","tutk_server":"disable"},"liveviewing":false,"recording":0}} Failed
26 Apr 14 22:53:06 info ipcam[1561]: [create_soft_guard_flow][196] softguard flow param: name=softguard thread_model=sync input_model=dropcurrent input_data_type= output_data_type=  bbl_sg_name=liveview bbl_sg_default_disable=disable bbl_sg_av_skip_check=enable
26 Apr 14 22:53:06 info ipcam[1561]: [SoftGuard][44] [flow] enter SoftGuard construct parm: bbl_sg_name=liveview bbl_sg_default_disable=disable bbl_sg_av_skip_check=enable
26 Apr 14 22:53:06 info ipcam[1561]: [SoftGuard][93] SoftGuard name:liveview default pass: 0 interval: 0 open_proc_statistic:0 statistic_interval:120
26 Apr 14 22:53:06 info ipcam[1561]: [create_liveview_flow:625] f_live create liveview flow success. tutk:0, agora:0
26 Apr 14 22:53:06 info ipcam[1561]: [l_monitor_thread_loop:537] f_live src/flow/flow_liveview.cpp: code arrive here.
26 Apr 14 22:53:06 info ipcam[1561]: [IoCtrl][150] liveview softguard pass set 1
26 Apr 14 22:53:06 info ipcam[1561]: [flow_liveview_enable:683] f_live [tutk] liveview enable:1
26 Apr 14 22:53:06 info ipcam[1561]: [IoCtrl][150] liveview softguard pass set 0
26 Apr 14 22:53:06 info ipcam[1561]: [flow_liveview_enable:683] f_live [tutk] liveview enable:0
26 Apr 14 22:53:07 info ipcam[1561]: [IoCtrl][150] liveview softguard pass set 1
26 Apr 14 22:53:07 info ipcam[1561]: [flow_liveview_enable:683] f_live [tutk] liveview enable:1
26 Apr 14 22:53:07 debug bbl_screen: ipcam syncingrtsp: false
26 Apr 14 22:53:08 info x1plus.services.x1plusd.mcproto: MC message: <MCMessage RSP #651 AP -> MC: <M971 seq 519, C0 O0 P0, response 0>>
26 Apr 14 22:53:08 info x1plus.services.x1plusd.mcproto: MC message: <MCMessage REQ #1133 MC -> AP: <M971 seq 519, C10 O0 P0, response None>>
26 Apr 14 22:53:11 info x1plus.services.x1plusd.modules.camera_watchdog: RTSP not enabled (rtsp_url='disable'), requesting restore via bbl_screen (attempt 1/3)
26 Apr 14 22:53:11 debug bbl_screen: device/x1plus [object Object]
26 Apr 14 22:53:11 debug bbl_screen: [x1p] camera_watchdog: restoring RTSP server to true
26 Apr 14 22:53:12 debug bbl_screen: BBLPrinter::publishMessage "liveview" "{\"command\":\"liveview\",\"op_protocols\":[{\"command\":\"init\",\"media_port\":322,\"passwd\":\"********\",\"server_use_tls\":1,\"streams_cfg\":\"default\",\"type\":\"rtsp\",\"username\":\"bblp\"}],\"peer_host\":\"bbl_screen\",\"sequence_id\":\"62\",\"version\":1}"
26 Apr 14 22:53:12 info ipcam[1561]: [liveview_bcsm_handler][21] Got bcsm operate reuqire from:bbl_screen
26 Apr 14 22:53:12 info ipcam[1561]: [liveview_bcsm_handler][144] Enable rtsp over tls.
26 Apr 14 22:53:12 info ipcam[1561]: src/flow/flow_liveview.cpp : create_bcsm_flow: 462
26 Apr 14 22:53:12 info ipcam[1561]: [RKMEDIA][RTSP_BBL][RtspServerFlow:123] live555/server/rtsp_server.cc : RtspServerFlow: 123
26 Apr 14 22:53:12 info ipcam[1561]: [RKMEDIA][RTSP_BBL][getInstanceMultiServer:68] getInstanceMultiServer: new server(bbl_rtsp_server), create new ok.
26 Apr 14 22:53:12 info ipcam[1561]: [RKMEDIA][RTSP_BBL][service_session_run:121] ================ service_session_run =================
26 Apr 14 22:53:12 info ipcam[1561]: [RKMEDIA][RTSP_BBL][sendMessage:270] sendMessage: before mtx.wait.
26 Apr 14 22:53:12 info ipcam[1561]: [RKMEDIA][RTSP_BBL][CheckEndlAndLog:65] Play this stream using the URL:  rtsps://10.0.0.227/streaming/live/1
26 Apr 14 22:53:12 info ipcam[1561]: [RKMEDIA][RTSP_BBL][addSession:247]  addSession : no audio. audioType =  
26 Apr 14 22:53:12 info ipcam[1561]: [RKMEDIA][RTSP_BBL][CheckEndlAndLog:65] success.
26 Apr 14 22:53:12 info ipcam[1561]: [RKMEDIA][RTSP_BBL][incomingMsgHandler1:180] incomingMsgHandler1: before mtx.notify
26 Apr 14 22:53:12 info ipcam[1561]: [RKMEDIA][RTSP_BBL][incomingMsgHandler1:185] incomingMsgHandler1: after mtx.notify
26 Apr 14 22:53:12 info ipcam[1561]: [RKMEDIA][RTSP_BBL][sendMessage:276] sendMessage: after mtx.wait.
26 Apr 14 22:53:12 info ipcam[1561]: [RKMEDIA][RTSP_BBL][RtspServerFlow:216] live555/server/rtsp_server.cc : RtspServerFlow: 216
26 Apr 14 22:53:12 info ipcam[1561]: [create_rtsp_server_flow:445] f_live create rtsp_flow ok
26 Apr 14 22:53:12 info ipcam[1561]: [RtspServerOpenTrackerSend:295] ok
26 Apr 14 22:53:12 info ipcam[1561]: [liveview_bcsm_handler][178] handle op_protocols rtsp init success.
26 Apr 14 22:53:12 debug bbl_screen: setRtspServer on info "{\"op_protocols\": [{\"command\": \"init\",\"result\": \"success\",\"streams\": [{\"item_id\": 0,\"tracks\": [{\"codec_type\": \"h264\",\"item_id\": 0,\"resolution\": \"1920x1080\",\"type\": \"video\"}],\"url\": \"rtsps://10.0.0.227:322/streaming/live/1\"}]}],\"peer_host\": \"ipcam\",\"result\": \"success\",\"sequence_id\": \"62\",\"version\": 1}"
26 Apr 14 22:53:12 debug bbl_screen: DeviceManager::putSetting sync printer.json "rtspServer" QVariant(bool, true)
26 Apr 14 22:53:14 debug bbl_screen: ipcam syncingrtsp: false
26 Apr 14 22:53:16 info x1plus.services.x1plusd.modules.camera_watchdog: RTSP server is enabled (rtsp_url='rtsps://10.0.0.227:322/streaming/live/1') — restore complete
26 Apr 14 22:53:18 info ipcam[1561]: [RKMEDIA][RTSP_BBL][createNewStreamSource:146] live555/server/h264_server_media_subsession.cc:createNewStreamSource:0x9f906218 - clientSessionId: 0x00000000
26 Apr 14 22:53:18 info ipcam[1561]: [RKMEDIA][RTSP_BBL][Source:284] Source :: 0x9f912d28 wakeFds[0] = -1, wakeFds[1]= -1.
26 Apr 14 22:53:18 info ipcam[1561]: [RKMEDIA][RTSP_BBL][createNewStreamSource:155] h264 framedsource : 0x9f90ac08, estBitrate = 1000 
26 Apr 14 22:53:18 info ipcam[1561]: [RKMEDIA][RTSP_BBL][createNewRTPSink:167] live555/server/h264_server_media_subsession.cc : createNewRTPSink: 167
26 Apr 14 22:53:18 info ipcam[1561]: [RKMEDIA][RTSP_BBL][createNewRTPSink:170] h264 rtp sink : 0x9f90ae30
26 Apr 14 22:53:18 info ipcam[1561]: [RtspHandlePlayVideo][320] get PlayVideo callback.
26 Apr 14 22:53:18 info ipcam[1561]: [RKMEDIA][RTSP_BBL][checkForAuxSDPLine1:112] live555/server/h264_server_media_subsession.cc : checkForAuxSDPLine1: 112
26 Apr 14 22:53:18 info ipcam[1561]: [RKMEDIA][RTSP_BBL][doStopGettingFrames:355] live555/server/live555_media_input.cc : doStopGettingFrames: 355
26 Apr 14 22:53:18 info ipcam[1561]: [RKMEDIA][RTSP_BBL][doStopGettingFrames:355] live555/server/live555_media_input.cc : doStopGettingFrames: 355
26 Apr 14 22:53:18 info ipcam[1561]: [RKMEDIA][RTSP_BBL][~VideoFramedSource:389] live555/server/live555_media_input.cc : ~VideoFramedSource: 389
26 Apr 14 22:53:18 info ipcam[1561]: [RKMEDIA][RTSP_BBL][~Source:303] ~Source::0x9f912d28 remain 0 buffers, will auto release
26 Apr 14 22:53:18 info ipcam[1561]: [RKMEDIA][RTSP_BBL][createNewStreamSource:146] live555/server/h264_server_media_subsession.cc:createNewStreamSource:0x9f906218 - clientSessionId: 0x78359317
26 Apr 14 22:53:18 info ipcam[1561]: [RKMEDIA][RTSP_BBL][Source:284] Source :: 0x9f90bcc8 wakeFds[0] = -1, wakeFds[1]= -1.
26 Apr 14 22:53:18 info ipcam[1561]: [RKMEDIA][RTSP_BBL][createNewStreamSource:155] h264 framedsource : 0x9f90ac08, estBitrate = 4510 
26 Apr 14 22:53:18 info ipcam[1561]: [RKMEDIA][RTSP_BBL][createNewRTPSink:167] live555/server/h264_server_media_subsession.cc : createNewRTPSink: 167
26 Apr 14 22:53:18 info ipcam[1561]: [RKMEDIA][RTSP_BBL][createNewRTPSink:170] h264 rtp sink : 0x9f90ae30
26 Apr 14 22:53:18 info ipcam[1561]: [RtspHandlePlayVideo][320] get PlayVideo callback.
26 Apr 14 22:53:18 info ipcam[1561]: [RKMEDIA][RTSP_BBL][Start:60] live555/server/live555_media_input.cc : Start: 60
26 Apr 14 22:53:18 info ipcam[1561]: [RKMEDIA][RTSP_BBL][startStream:57] live555/server/h264_server_media_subsession.cc:startStream:0x9f906218 - clientSessionId: 0x78359317
26 Apr 14 22:53:20 info ipcam[1561]: [RKMEDIA][RTSP_BBL][deleteStream:64] deleteStream - clientSessionId: 0x78359317
26 Apr 14 22:53:20 info ipcam[1561]: [RKMEDIA][RTSP_BBL][Stop:65] live555/server/live555_media_input.cc : Stop: 65
26 Apr 14 22:53:20 info ipcam[1561]: [RtspHandleStopVideo][338] get StopVideo callback.
26 Apr 14 22:53:20 info ipcam[1561]: [RKMEDIA][RTSP_BBL][doStopGettingFrames:355] live555/server/live555_media_input.cc : doStopGettingFrames: 355
26 Apr 14 22:53:20 info ipcam[1561]: [RKMEDIA][RTSP_BBL][doStopGettingFrames:355] live555/server/live555_media_input.cc : doStopGettingFrames: 355
26 Apr 14 22:53:20 info ipcam[1561]: [RKMEDIA][RTSP_BBL][~VideoFramedSource:389] live555/server/live555_media_input.cc : ~VideoFramedSource: 389
26 Apr 14 22:53:20 info ipcam[1561]: [RKMEDIA][RTSP_BBL][createNewStreamSource:146] live555/server/h264_server_media_subsession.cc:createNewStreamSource:0x9f906218 - clientSessionId: 0xbf2241d8
26 Apr 14 22:53:20 info ipcam[1561]: [RKMEDIA][RTSP_BBL][Source:284] Source :: 0x9f90c250 wakeFds[0] = -1, wakeFds[1]= -1.
26 Apr 14 22:53:20 info ipcam[1561]: [RKMEDIA][RTSP_BBL][createNewStreamSource:155] h264 framedsource : 0x9f90ac08, estBitrate = 5381 
26 Apr 14 22:53:20 info ipcam[1561]: [RKMEDIA][RTSP_BBL][createNewRTPSink:167] live555/server/h264_server_media_subsession.cc : createNewRTPSink: 167
26 Apr 14 22:53:20 info ipcam[1561]: [RKMEDIA][RTSP_BBL][createNewRTPSink:170] h264 rtp sink : 0x9f90ae30
26 Apr 14 22:53:20 info ipcam[1561]: [RtspHandlePlayVideo][320] get PlayVideo callback.
26 Apr 14 22:53:20 info ipcam[1561]: [RKMEDIA][RTSP_BBL][Start:60] live555/server/live555_media_input.cc : Start: 60
26 Apr 14 22:53:20 info ipcam[1561]: [RKMEDIA][RTSP_BBL][startStream:57] live555/server/h264_server_media_subsession.cc:startStream:0x9f906218 - clientSessionId: 0xbf2241d8
26 Apr 14 22:53:20 info ipcam[1561]: [RKMEDIA][RTSP_BBL][~Source:303] ~Source::0x9f90bcc8 remain 0 buffers, will auto release
26 Apr 14 22:53:58 info x1plus.services.x1plusd.mcproto: MC message: <MCMessage RSP #1425 AP -> MC: <M971 seq 520, C0 O0 P0, response 0>>
26 Apr 14 22:53:58 info x1plus.services.x1plusd.mcproto: MC message: <MCMessage REQ #1135 MC -> AP: <M971 seq 520, C10 O0 P0, response None>>
26 Apr 14 22:54:50 info x1plus.services.x1plusd.mcproto: MC message: <MCMessage RSP #2227 AP -> MC: <M971 seq 521, C0 O0 P0, response 0>>
26 Apr 14 22:54:50 info x1plus.services.x1plusd.mcproto: MC message: <MCMessage REQ #1137 MC -> AP: <M971 seq 521, C10 O0 P0, response None>>
26 Apr 14 22:55:44 info x1plus.services.x1plusd.mcproto: MC message: <MCMessage RSP #3070 AP -> MC: <M971 seq 522, C0 O0 P0, response 0>>
26 Apr 14 22:55:44 info x1plus.services.x1plusd.mcproto: MC message: <MCMessage REQ #1139 MC -> AP: <M971 seq 522, C10 O0 P0, response None>>
26 Apr 14 22:56:06 info bbl_watchdog: in watchdog mainloop
26 Apr 14 22:56:08 info forward[1629]: usb camera online is 1
26 Apr 14 22:56:41 info x1plus.services.x1plusd.mcproto: MC message: <MCMessage RSP #3948 AP -> MC: <M971 seq 523, C0 O0 P0, response 0>>
26 Apr 14 22:56:41 info x1plus.services.x1plusd.mcproto: MC message: <MCMessage REQ #1141 MC -> AP: <M971 seq 523, C10 O0 P0, response None>>
26 Apr 14 22:57:16 info ipcam[1561]: [RKMEDIA][RTSP_BBL][deleteStream:64] deleteStream - clientSessionId: 0xbf2241d8
26 Apr 14 22:57:16 info ipcam[1561]: [RKMEDIA][RTSP_BBL][Stop:65] live555/server/live555_media_input.cc : Stop: 65
26 Apr 14 22:57:16 info ipcam[1561]: [RtspHandleStopVideo][338] get StopVideo callback.
26 Apr 14 22:57:16 info ipcam[1561]: [RKMEDIA][RTSP_BBL][doStopGettingFrames:355] live555/server/live555_media_input.cc : doStopGettingFrames: 355
26 Apr 14 22:57:16 info ipcam[1561]: [RKMEDIA][RTSP_BBL][doStopGettingFrames:355] live555/server/live555_media_input.cc : doStopGettingFrames: 355
26 Apr 14 22:57:16 info ipcam[1561]: [RKMEDIA][RTSP_BBL][~VideoFramedSource:389] live555/server/live555_media_input.cc : ~VideoFramedSource: 389
26 Apr 14 22:57:16 info ipcam[1561]: [RKMEDIA][RTSP_BBL][~Source:303] ~Source::0x9f90c250 remain 0 buffers, will auto release
26 Apr 14 22:57:16 info ipcam[1561]: [RKMEDIA][RTSP_BBL][createNewStreamSource:146] live555/server/h264_server_media_subsession.cc:createNewStreamSource:0x9f906218 - clientSessionId: 0x63b919fa
26 Apr 14 22:57:16 info ipcam[1561]: [RKMEDIA][RTSP_BBL][Source:284] Source :: 0x9f9083a8 wakeFds[0] = -1, wakeFds[1]= -1.
26 Apr 14 22:57:16 info ipcam[1561]: [RKMEDIA][RTSP_BBL][createNewStreamSource:155] h264 framedsource : 0x9f90ac08, estBitrate = 8758 
26 Apr 14 22:57:16 info ipcam[1561]: [RKMEDIA][RTSP_BBL][createNewRTPSink:167] live555/server/h264_server_media_subsession.cc : createNewRTPSink: 167
26 Apr 14 22:57:16 info ipcam[1561]: [RKMEDIA][RTSP_BBL][createNewRTPSink:170] h264 rtp sink : 0x9f90ae30
26 Apr 14 22:57:16 info ipcam[1561]: [RtspHandlePlayVideo][320] get PlayVideo callback.
26 Apr 14 22:57:16 info ipcam[1561]: [RKMEDIA][RTSP_BBL][Start:60] live555/server/live555_media_input.cc : Start: 60
26 Apr 14 22:57:16 info ipcam[1561]: [RKMEDIA][RTSP_BBL][startStream:57] live555/server/h264_server_media_subsession.cc:startStream:0x9f906218 - clientSessionId: 0x63b919fa
26 Apr 14 22:57:42 info x1plus.services.x1plusd.mcproto: MC message: <MCMessage REQ #1143 MC -> AP: <M971 seq 524, C10 O0 P0, response None>>
26 Apr 14 22:57:42 info x1plus.services.x1plusd.mcproto: MC message: <MCMessage RSP #818 AP -> MC: <M971 seq 524, C0 O0 P0, response 0>>
26 Apr 14 22:58:37 info x1plus.services.x1plusd.mcproto: MC message: <MCMessage RSP #1661 AP -> MC: <M971 seq 525, C0 O0 P0, response 0>>
26 Apr 14 22:58:37 info x1plus.services.x1plusd.mcproto: MC message: <MCMessage REQ #1145 MC -> AP: <M971 seq 525, C10 O0 P0, response None>>
26 Apr 14 22:59:30 info x1plus.services.x1plusd.mcproto: MC message: <MCMessage RSP #2491 AP -> MC: <M971 seq 526, C0 O0 P0, response 0>>
26 Apr 14 22:59:30 info x1plus.services.x1plusd.mcproto: MC message: <MCMessage REQ #1147 MC -> AP: <M971 seq 526, C10 O0 P0, response None>>
26 Apr 14 23:00:27 info x1plus.services.x1plusd.mcproto: MC message: <MCMessage RSP #3385 AP -> MC: <M971 seq 527, C0 O0 P0, response 0>>
26 Apr 14 23:00:27 info x1plus.services.x1plusd.mcproto: MC message: <MCMessage REQ #1149 MC -> AP: <M971 seq 527, C10 O0 P0, response None>>
26 Apr 14 23:01:24 info x1plus.services.x1plusd.mcproto: MC message: <MCMessage RSP #173 AP -> MC: <M971 seq 528, C0 O0 P0, response 0>>
26 Apr 14 23:01:24 info x1plus.services.x1plusd.mcproto: MC message: <MCMessage REQ #1151 MC -> AP: <M971 seq 528, C10 O0 P0, response None>>
26 Apr 14 23:02:19 info x1plus.services.x1plusd.mcproto: MC message: <MCMessage RSP #1015 AP -> MC: <M971 seq 529, C0 O0 P0, response 0>>
26 Apr 14 23:02:19 info x1plus.services.x1plusd.mcproto: MC message: <MCMessage REQ #1153 MC -> AP: <M971 seq 529, C10 O0 P0, response None>>
26 Apr 14 23:03:22 info x1plus.services.x1plusd.mcproto: MC message: <MCMessage RSP #1996 AP -> MC: <M971 seq 530, C0 O0 P0, response 0>>
26 Apr 14 23:03:22 info x1plus.services.x1plusd.mcproto: MC message: <MCMessage REQ #1155 MC -> AP: <M971 seq 530, C10 O0 P0, response None>>
26 Apr 14 23:04:25 info x1plus.services.x1plusd.mcproto: MC message: <MCMessage RSP #2973 AP -> MC: <M971 seq 531, C0 O0 P0, response 0>>
26 Apr 14 23:04:26 info x1plus.services.x1plusd.mcproto: MC message: <MCMessage REQ #1157 MC -> AP: <M971 seq 531, C10 O0 P0, response None>>
26 Apr 14 23:05:31 info x1plus.services.x1plusd.mcproto: MC message: <MCMessage RSP #3991 AP -> MC: <M971 seq 532, C0 O0 P0, response 0>>
26 Apr 14 23:05:31 info x1plus.services.x1plusd.mcproto: MC message: <MCMessage REQ #1159 MC -> AP: <M971 seq 532, C10 O0 P0, response None>>
26 Apr 14 23:06:06 info bbl_watchdog: in watchdog mainloop
26 Apr 14 23:06:08 info forward[1629]: usb camera online is 1
26 Apr 14 23:06:36 info x1plus.services.x1plusd.mcproto: MC message: <MCMessage RSP #893 AP -> MC: <M971 seq 533, C0 O0 P0, response 0>>
26 Apr 14 23:06:36 info x1plus.services.x1plusd.mcproto: MC message: <MCMessage REQ #1161 MC -> AP: <M971 seq 533, C10 O0 P0, response None>>
26 Apr 14 23:07:38 info x1plus.services.x1plusd.mcproto: MC message: <MCMessage REQ #1163 MC -> AP: <M971 seq 534, C10 O0 P0, response None>>
26 Apr 14 23:07:39 info x1plus.services.x1plusd.mcproto: MC message: <MCMessage RSP #1854 AP -> MC: <M971 seq 534, C0 O0 P0, response 0>>
26 Apr 14 23:08:40 info x1plus.services.x1plusd.mcproto: MC message: <MCMessage RSP #2799 AP -> MC: <M971 seq 535, C0 O0 P0, response 0>>
26 Apr 14 23:08:40 info x1plus.services.x1plusd.mcproto: MC message: <MCMessage REQ #1165 MC -> AP: <M971 seq 535, C10 O0 P0, response None>>
26 Apr 14 23:09:40 info x1plus.services.x1plusd.mcproto: MC message: <MCMessage RSP #3730 AP -> MC: <M971 seq 536, C0 O0 P0, response 0>>
26 Apr 14 23:09:40 info x1plus.services.x1plusd.mcproto: MC message: <MCMessage REQ #1167 MC -> AP: <M971 seq 536, C10 O0 P0, response None>>
26 Apr 14 23:10:41 info x1plus.services.x1plusd.mcproto: MC message: <MCMessage REQ #1169 MC -> AP: <M971 seq 537, C10 O0 P0, response None>>
26 Apr 14 23:10:41 info x1plus.services.x1plusd.mcproto: MC message: <MCMessage RSP #591 AP -> MC: <M971 seq 537, C0 O0 P0, response 0>>
26 Apr 14 23:11:41 info x1plus.services.x1plusd.mcproto: MC message: <MCMessage RSP #1534 AP -> MC: <M971 seq 538, C0 O0 P0, response 0>>
26 Apr 14 23:11:41 info x1plus.services.x1plusd.mcproto: MC message: <MCMessage REQ #1171 MC -> AP: <M971 seq 538, C10 O0 P0, response None>>
26 Apr 14 23:12:17 info ipcam[1561]: [RtspHandlePlayVideo][320] get PlayVideo callback.
26 Apr 14 23:12:17 info ipcam[1561]: [RKMEDIA][RTSP_BBL][startStream:57] live555/server/h264_server_media_subsession.cc:startStream:0x9f906218 - clientSessionId: 0xa61bd71e
26 Apr 14 23:12:20 info ipcam[1561]: [RKMEDIA][RTSP_BBL][deleteStream:64] deleteStream - clientSessionId: 0x63b919fa
26 Apr 14 23:12:41 info x1plus.services.x1plusd.mcproto: MC message: <MCMessage RSP #2473 AP -> MC: <M971 seq 539, C0 O0 P0, response 0>>
26 Apr 14 23:12:41 info x1plus.services.x1plusd.mcproto: MC message: <MCMessage REQ #1173 MC -> AP: <M971 seq 539, C10 O0 P0, response None>>
26 Apr 14 23:13:42 info x1plus.services.x1plusd.mcproto: MC message: <MCMessage RSP #3438 AP -> MC: <M971 seq 540, C0 O0 P0, response 0>>
26 Apr 14 23:13:42 info x1plus.services.x1plusd.mcproto: MC message: <MCMessage REQ #1175 MC -> AP: <M971 seq 540, C10 O0 P0, response None>>
26 Apr 14 23:14:42 info x1plus.services.x1plusd.mcproto: MC message: <MCMessage REQ #1177 MC -> AP: <M971 seq 541, C10 O0 P0, response None>>
26 Apr 14 23:14:42 info x1plus.services.x1plusd.mcproto: MC message: <MCMessage RSP #286 AP -> MC: <M971 seq 541, C0 O0 P0, response 0>>
26 Apr 14 23:15:43 info x1plus.services.x1plusd.mcproto: MC message: <MCMessage RSP #1225 AP -> MC: <M971 seq 542, C0 O0 P0, response 0>>
26 Apr 14 23:15:43 info x1plus.services.x1plusd.mcproto: MC message: <MCMessage REQ #1179 MC -> AP: <M971 seq 542, C10 O0 P0, response None>>
26 Apr 14 23:16:06 info bbl_watchdog: in watchdog mainloop
26 Apr 14 23:16:09 info forward[1629]: usb camera online is 1
26 Apr 14 23:16:43 info x1plus.services.x1plusd.mcproto: MC message: <MCMessage RSP #2174 AP -> MC: <M971 seq 543, C0 O0 P0, response 0>>
26 Apr 14 23:16:43 info x1plus.services.x1plusd.mcproto: MC message: <MCMessage REQ #1181 MC -> AP: <M971 seq 543, C10 O0 P0, response None>>
26 Apr 14 23:17:45 info x1plus.services.x1plusd.mcproto: MC message: <MCMessage REQ #1183 MC -> AP: <M971 seq 544, C10 O0 P0, response None>>
26 Apr 14 23:17:46 info x1plus.services.x1plusd.mcproto: MC message: <MCMessage RSP #3153 AP -> MC: <M971 seq 544, C0 O0 P0, response 0>>
26 Apr 14 23:18:47 info x1plus.services.x1plusd.mcproto: MC message: <MCMessage RSP #14 AP -> MC: <M971 seq 545, C0 O0 P0, response 0>>
26 Apr 14 23:18:47 info x1plus.services.x1plusd.mcproto: MC message: <MCMessage REQ #1185 MC -> AP: <M971 seq 545, C10 O0 P0, response None>>
26 Apr 14 23:19:47 info x1plus.services.x1plusd.mcproto: MC message: <MCMessage RSP #955 AP -> MC: <M971 seq 546, C0 O0 P0, response 0>>
26 Apr 14 23:19:47 info x1plus.services.x1plusd.mcproto: MC message: <MCMessage REQ #1187 MC -> AP: <M971 seq 546, C10 O0 P0, response None>>
26 Apr 14 23:20:49 info x1plus.services.x1plusd.mcproto: MC message: <MCMessage RSP #1923 AP -> MC: <M971 seq 547, C0 O0 P0, response 0>>
26 Apr 14 23:20:49 info x1plus.services.x1plusd.mcproto: MC message: <MCMessage REQ #1189 MC -> AP: <M971 seq 547, C10 O0 P0, response None>>
26 Apr 14 23:21:49 info x1plus.services.x1plusd.mcproto: MC message: <MCMessage RSP #2852 AP -> MC: <M971 seq 548, C0 O0 P0, response 0>>
26 Apr 14 23:21:49 info x1plus.services.x1plusd.mcproto: MC message: <MCMessage REQ #1191 MC -> AP: <M971 seq 548, C10 O0 P0, response None>>
26 Apr 14 23:22:47 info x1plus.services.x1plusd.mcproto: MC message: <MCMessage RSP #3768 AP -> MC: <M971 seq 549, C0 O0 P0, response 0>>
26 Apr 14 23:22:47 info x1plus.services.x1plusd.mcproto: MC message: <MCMessage REQ #1193 MC -> AP: <M971 seq 549, C10 O0 P0, response None>>
26 Apr 14 23:23:45 info x1plus.services.x1plusd.mcproto: MC message: <MCMessage RSP #580 AP -> MC: <M971 seq 550, C0 O0 P0, response 0>>
26 Apr 14 23:23:45 info x1plus.services.x1plusd.mcproto: MC message: <MCMessage REQ #1195 MC -> AP: <M971 seq 550, C10 O0 P0, response None>>
26 Apr 14 23:24:44 info x1plus.services.x1plusd.mcproto: MC message: <MCMessage RSP #1502 AP -> MC: <M971 seq 551, C0 O0 P0, response 0>>
26 Apr 14 23:24:44 info x1plus.services.x1plusd.mcproto: MC message: <MCMessage REQ #1197 MC -> AP: <M971 seq 551, C10 O0 P0, response None>>
26 Apr 14 23:25:46 info x1plus.services.x1plusd.mcproto: MC message: <MCMessage RSP #2464 AP -> MC: <M971 seq 552, C0 O0 P0, response 0>>
26 Apr 14 23:25:46 info x1plus.services.x1plusd.mcproto: MC message: <MCMessage REQ #1199 MC -> AP: <M971 seq 552, C10 O0 P0, response None>>
26 Apr 14 23:26:06 info bbl_watchdog: in watchdog mainloop
26 Apr 14 23:26:09 info forward[1629]: usb camera online is 1
26 Apr 14 23:26:44 info x1plus.services.x1plusd.mcproto: MC message: <MCMessage RSP #3365 AP -> MC: <M971 seq 553, C0 O0 P0, response 0>>
26 Apr 14 23:26:44 info x1plus.services.x1plusd.mcproto: MC message: <MCMessage REQ #1201 MC -> AP: <M971 seq 553, C10 O0 P0, response None>>
26 Apr 14 23:27:46 info x1plus.services.x1plusd.mcproto: MC message: <MCMessage REQ #1203 MC -> AP: <M971 seq 554, C10 O0 P0, response None>>
26 Apr 14 23:27:46 info x1plus.services.x1plusd.mcproto: MC message: <MCMessage RSP #240 AP -> MC: <M971 seq 554, C0 O0 P0, response 0>>
26 Apr 14 23:28:46 info x1plus.services.x1plusd.mcproto: MC message: <MCMessage RSP #1167 AP -> MC: <M971 seq 555, C0 O0 P0, response 0>>
26 Apr 14 23:28:46 info x1plus.services.x1plusd.mcproto: MC message: <MCMessage REQ #1205 MC -> AP: <M971 seq 555, C10 O0 P0, response None>>
26 Apr 14 23:29:45 info x1plus.services.x1plusd.mcproto: MC message: <MCMessage RSP #2085 AP -> MC: <M971 seq 556, C0 O0 P0, response 0>>
26 Apr 14 23:29:45 info x1plus.services.x1plusd.mcproto: MC message: <MCMessage REQ #1207 MC -> AP: <M971 seq 556, C10 O0 P0, response None>>
26 Apr 14 23:30:47 info x1plus.services.x1plusd.mcproto: MC message: <MCMessage RSP #3060 AP -> MC: <M971 seq 557, C0 O0 P0, response 0>>
26 Apr 14 23:30:47 info x1plus.services.x1plusd.mcproto: MC message: <MCMessage REQ #1209 MC -> AP: <M971 seq 557, C10 O0 P0, response None>>
26 Apr 14 23:31:46 info x1plus.services.x1plusd.mcproto: MC message: <MCMessage RSP #3980 AP -> MC: <M971 seq 558, C0 O0 P0, response 0>>
26 Apr 14 23:31:46 info x1plus.services.x1plusd.mcproto: MC message: <MCMessage REQ #1211 MC -> AP: <M971 seq 558, C10 O0 P0, response None>>
26 Apr 14 23:32:49 info x1plus.services.x1plusd.mcproto: MC message: <MCMessage RSP #858 AP -> MC: <M971 seq 559, C0 O0 P0, response 0>>
26 Apr 14 23:32:49 info x1plus.services.x1plusd.mcproto: MC message: <MCMessage REQ #1213 MC -> AP: <M971 seq 559, C10 O0 P0, response None>>
26 Apr 14 23:33:50 info x1plus.services.x1plusd.mcproto: MC message: <MCMessage RSP #1823 AP -> MC: <M971 seq 560, C0 O0 P0, response 0>>
26 Apr 14 23:33:50 info x1plus.services.x1plusd.mcproto: MC message: <MCMessage REQ #1215 MC -> AP: <M971 seq 560, C10 O0 P0, response None>>
26 Apr 14 23:34:52 info x1plus.services.x1plusd.mcproto: MC message: <MCMessage RSP #2786 AP -> MC: <M971 seq 561, C0 O0 P0, response 0>>
26 Apr 14 23:34:52 info x1plus.services.x1plusd.mcproto: MC message: <MCMessage REQ #1217 MC -> AP: <M971 seq 561, C10 O0 P0, response None>>
26 Apr 14 23:35:52 info x1plus.services.x1plusd.mcproto: MC message: <MCMessage RSP #3710 AP -> MC: <M971 seq 562, C0 O0 P0, response 0>>
26 Apr 14 23:35:52 info x1plus.services.x1plusd.mcproto: MC message: <MCMessage REQ #1219 MC -> AP: <M971 seq 562, C10 O0 P0, response None>>
26 Apr 14 23:36:06 info bbl_watchdog: in watchdog mainloop
26 Apr 14 23:36:09 info forward[1629]: usb camera online is 1
26 Apr 14 23:36:51 info x1plus.services.x1plusd.mcproto: MC message: <MCMessage RSP #536 AP -> MC: <M971 seq 563, C0 O0 P0, response 0>>
26 Apr 14 23:36:51 info x1plus.services.x1plusd.mcproto: MC message: <MCMessage REQ #1221 MC -> AP: <M971 seq 563, C10 O0 P0, response None>>
26 Apr 14 23:37:51 info x1plus.services.x1plusd.mcproto: MC message: <MCMessage REQ #1223 MC -> AP: <M971 seq 564, C10 O0 P0, response None>>
26 Apr 14 23:37:51 info x1plus.services.x1plusd.mcproto: MC message: <MCMessage RSP #1475 AP -> MC: <M971 seq 564, C0 O0 P0, response 0>>
26 Apr 14 23:38:49 info x1plus.services.x1plusd.mcproto: MC message: <MCMessage RSP #2374 AP -> MC: <M971 seq 565, C0 O0 P0, response 0>>
26 Apr 14 23:38:49 info x1plus.services.x1plusd.mcproto: MC message: <MCMessage REQ #1225 MC -> AP: <M971 seq 565, C10 O0 P0, response None>>
26 Apr 14 23:39:48 info x1plus.services.x1plusd.mcproto: MC message: <MCMessage RSP #3293 AP -> MC: <M971 seq 566, C0 O0 P0, response 0>>
26 Apr 14 23:39:48 info x1plus.services.x1plusd.mcproto: MC message: <MCMessage REQ #1227 MC -> AP: <M971 seq 566, C10 O0 P0, response None>>
26 Apr 14 23:40:50 info x1plus.services.x1plusd.mcproto: MC message: <MCMessage RSP #170 AP -> MC: <M971 seq 567, C0 O0 P0, response 0>>
26 Apr 14 23:40:50 info x1plus.services.x1plusd.mcproto: MC message: <MCMessage REQ #1229 MC -> AP: <M971 seq 567, C10 O0 P0, response None>>
26 Apr 14 23:41:53 info x1plus.services.x1plusd.mcproto: MC message: <MCMessage RSP #1132 AP -> MC: <M971 seq 568, C0 O0 P0, response 0>>
26 Apr 14 23:41:53 info x1plus.services.x1plusd.mcproto: MC message: <MCMessage REQ #1231 MC -> AP: <M971 seq 568, C10 O0 P0, response None>>
26 Apr 14 23:42:52 info x1plus.services.x1plusd.mcproto: MC message: <MCMessage RSP #2052 AP -> MC: <M971 seq 569, C0 O0 P0, response 0>>
26 Apr 14 23:42:52 info x1plus.services.x1plusd.mcproto: MC message: <MCMessage REQ #1233 MC -> AP: <M971 seq 569, C10 O0 P0, response None>>
26 Apr 14 23:43:52 info x1plus.services.x1plusd.mcproto: MC message: <MCMessage RSP #2978 AP -> MC: <M971 seq 570, C0 O0 P0, response 0>>
26 Apr 14 23:43:52 info x1plus.services.x1plusd.mcproto: MC message: <MCMessage REQ #1235 MC -> AP: <M971 seq 570, C10 O0 P0, response None>>
26 Apr 14 23:44:55 info x1plus.services.x1plusd.mcproto: MC message: <MCMessage RSP #3955 AP -> MC: <M971 seq 571, C0 O0 P0, response 0>>
26 Apr 14 23:44:55 info x1plus.services.x1plusd.mcproto: MC message: <MCMessage REQ #1237 MC -> AP: <M971 seq 571, C10 O0 P0, response None>>
26 Apr 14 23:45:55 info x1plus.services.x1plusd.mcproto: MC message: <MCMessage RSP #781 AP -> MC: <M971 seq 572, C0 O0 P0, response 0>>
26 Apr 14 23:45:55 info x1plus.services.x1plusd.mcproto: MC message: <MCMessage REQ #1239 MC -> AP: <M971 seq 572, C10 O0 P0, response None>>
26 Apr 14 23:46:06 info bbl_watchdog: in watchdog mainloop
```
</details>

**Comment by lightmaster** [comment]
Got this message on the printer during the 2nd print on this patch.

<img width="352" height="202" alt="Image" src="https://github.com/user-attachments/assets/9deb40d0-6934-4874-a4b0-8bb6d12ede94" />

**Comment by mikefromdot** [comment]
hmmm thats an odd one.

I did sequential prints and didnt have this occur.

afaik this shouldn't be related to what this watchdog does?

The error code is VERY generic, does ignoring it allow you to attempt a print again?

**Comment by lightmaster** [comment]
Print's still going and everything looks good with the print itself so far. Didn't notice anything was up until I opened up OrcaSlicer to prep my next print and saw the message on the devices tab. Gonna reboot the printer in a couple hours when this gets done and see if it goes away and if it comes back with the next print.

**Comment by jwise** [comment]
"System state is abnormal" is "a service crashed", IIRC.  I can't remember what triggers it, though.  Probably syslog (maybe syslogs in the past?) should have detail from around when it happened.

**Comment by mikefromdot** [comment]
So I did find a problem of my own making. 
I was rebooting the printer for another thing to test and it was causing the following (LAN Mode Liveview failed to open, please try again)

Narrowed it down to the watchdog firing off just after boot and seeing that ipcam hasnt fully started yet. This causes ipcam to restart again even though it wasnt ready.

Added a 60 second buffer after boot before the watchdog probes.

edit: still learning proper git usage apologies in advance for the dumb things I do. Going forward things I do will only happen in my fork until i'm ready to get them reviewed.

**Comment by mikefromdot** [comment]
Josh has merged the ipcam fix into main for the next release. Gonna close this.

**Comment by Desterly** [comment]
I know this is closed but an FYI, i got the "system state is abnormal" today.  I believe it's linked to the fact that the camera got real dark during a print so I switched to 1080p back to 720p in orcaslicer which corrected the brightness, but probably triggered the watchdog issue you mentioned.  Just something to be aware of.  I'll have to keep an eye on syslog to see if it does it during a print again to narrow down exact issue.

**Comment by mikefromdot** [comment]
> I know this is closed but an FYI, i got the "system state is abnormal" today. I believe it's linked to the fact that the camera got real dark during a print so I switched to 1080p back to 720p in orcaslicer which corrected the brightness, but probably triggered the watchdog issue you mentioned. Just something to be aware of. I'll have to keep an eye on syslog to see if it does it during a print again to narrow down exact issue.

Are you running a self built release? This currently has not made it into a official release.

**Comment by Desterly** [comment]
> > I know this is closed but an FYI, i got the "system state is abnormal" today. I believe it's linked to the fact that the camera got real dark during a print so I switched to 1080p back to 720p in orcaslicer which corrected the brightness, but probably triggered the watchdog issue you mentioned. Just something to be aware of. I'll have to keep an eye on syslog to see if it does it during a print again to narrow down exact issue.
> 
> Are you running a self built release? This currently has not made it into a official release.

Yes.  built it last night... for this commit actually

**Comment by mikefromdot** [comment]
Hmmm I've only ran across that once myself and it didnt actually affect anything for me. 
Let me pull my log and see what it was doing.

Also as an fyi I do have a PR for a slight fix related to this awaiting review/approval. The ipcam is a little varied on how fast it starts so it can error out on liveview enablement.

**Comment by Desterly** [comment]
No i didn't add the fix PR.   I'll send another printjob and see if I can reproduce it.   

I know that when recording a timelapse, the camera brightness is reset when the print job starts.  Switching resolution causes the camera to refocus and validate brightness.   I'm not sure if it restarts the camera service to do it, but it's possible that the watchdog kicked in there while it was restarting similar to the startup issue that was mentioned above.

EDIT:  maybe it was a fluke because that job printed fine... swapping camera resolutions didn't cause the error.   I'll keep an eye on it though

**Comment by mikefromdot** [comment]
If you can continue running this as it doesnt really affect a print and if you know how to grab me the syslog. I'd really like to find out whats being so angry with this.

**Comment by Desterly** [comment]
Yeah I will..  it didn't effect the print, just the timelapse but I'll keep an eye on it.

**Comment by andypiper** [comment]
Just started using Bambuddy and I've been thinking about how it could be integrated with X1Plus via a community add-on... subscribing to this thread in case an X1Plus update is going to be needed in the meantime.

**Comment by mikefromdot** [comment]
afaik there really doesnt need to be anything between the two. I've been using bambuddy and X1P for a while and other than this issue they both just work.

**Comment by andypiper** [comment]
Right (apart potentially from the camera issue) - I was thinking more of exposing more of the capabilities of X1P to Bambuddy since they both support actions and in theory you can get much more data from X1P during a print. Just an idea!

**Comment by agreenbhm** [comment]
@mikefromdot I just wanted to say THANK YOU for your great work on this. I upgraded to X1Plus a few days ago hoping that it would resolve this issue and was disappointed to see that the release version didn't. After reading through this issue and your PR and compiling from master, all is well now. Thanks so much!

**Comment by mikefromdot** [comment]
> [@mikefromdot](https://github.com/mikefromdot) I just wanted to say THANK YOU for your great work on this. I upgraded to X1Plus a few days ago hoping that it would resolve this issue and was disappointed to see that the release version didn't. After reading through this issue and your PR and compiling from master, all is well now. Thanks so much!

Thank you for the kind words, just as an fyi there is a bug with this and how I did it, Its nothing that will break your printer just an annoying liveview mesage on the ui.
The fix is pending review, might be a bit as josh has been quite busy.

**Comment by agreenbhm** [comment]
> > [@mikefromdot](https://github.com/mikefromdot) I just wanted to say THANK YOU for your great work on this. I upgraded to X1Plus a few days ago hoping that it would resolve this issue and was disappointed to see that the release version didn't. After reading through this issue and your PR and compiling from master, all is well now. Thanks so much!
> 
> Thank you for the kind words, just as an fyi there is a bug with this and how I did it, Its nothing that will break your printer just an annoying liveview mesage on the ui. The fix is pending review, might be a bit as josh has been quite busy.

Thank you for the heads-up. Is this PR the fix? https://github.com/X1Plus/X1Plus/pull/560
